,Start Date,Start Price,End Date,End Price,Weekly Returns,Bin Label,News,Basics
0,2023-07-02,113.78477478027344,2023-07-09,107.4836654663086,-0.055377438028354264,D5+,"[{""date"": ""20230702044500"", ""headline"": ""Week In Review: CMBG Out-Licenses Two CAR-T Candidates To Janssen For $245 Million Upfront"", ""summary"": ""Two leading Chinese biotech companies join forces with Merck to develop next-generation immuno-oncology therapies. Click here to find out more.""}, {""date"": ""20230702051900"", ""headline"": ""Week In Review: CMBG Out-Licenses 2 CAR-T Candidates To Janssen For $245 Million Upfront"", ""summary"": ""Looking for stock market analysis and research with proves results? Zacks.com offers in-depth financial research with over 30years of proven results.""}, {""date"": ""20230702080145"", ""headline"": ""Dividend Champion, Contender, And Challenger Highlights: Week Of July 2"", ""summary"": ""A weekly summary of dividend activity for Dividend Champions, Contenders, and Challengers. Click here to read more.""}, {""date"": ""20230703081300"", ""headline"": ""The 3 Best Dividend ETFs to Buy for July"", ""summary"": ""Looking for stock market analysis and research with proves results? Zacks.com offers in-depth financial research with over 30years of proven results.""}, {""date"": ""20230703092100"", ""headline"": ""Video: Dow Movers: MRK, GS"", ""summary"": ""Looking for stock market analysis and research with proves results? Zacks.com offers in-depth financial research with over 30years of proven results.""}, {""date"": ""20230703133925"", ""headline"": ""Vera: Repurposed Molecule Program Does Not Impress"", ""summary"": ""Vera Therapeutics, Inc. is developing an old molecule it licensed from Merck. Trials conducted years ago produced unimpressive results. Read more on VERA.""}, {""date"": ""20230704045746"", ""headline"": ""Verve: Exciting Deal With Eli Lilly, But Still Neutral (Reiterating Hold)"", ""summary"": ""Verve Therapeutics announced a partnership with Eli Lilly & Co., focusing on in-vivo gene editing technology. Read why VERV stock is a Hold.""}, {""date"": ""20230705063150"", ""headline"": ""China extends squeezed-out foreign pharmaceuticals firms an olive branch"", ""summary"": ""China's Commerce Minister\ntold foreign pharmaceuticals firms they can expect more\ndevelopment opportunities during a roundtable on Wednesday, his\nministry said, as drugmakers bemoan government...""}, {""date"": ""20230705065300"", ""headline"": ""NanoViricides Inc. (NYSE American: NNVC) Begins Long-Awaited Clinical Trials For Its Anti-Viral Nanomedicine NV-CoV-2, Oral, Amid Continuing Need For COVID Treatment"", ""summary"": ""Looking for stock market analysis and research with proves results? Zacks.com offers in-depth financial research with over 30years of proven results.""}, {""date"": ""20230705071100"", ""headline"": ""Analysts\u2019 Top Healthcare Picks: Merck & Company (MRK), PTC Therapeutics (PTCT)"", ""summary"": ""Looking for stock market analysis and research with proves results? Zacks.com offers in-depth financial research with over 30years of proven results.""}, {""date"": ""20230705090553"", ""headline"": ""Moderna strikes deal to develop mRNA drugs in China "", ""summary"": ""The deal is the biotech company's first agreement with China after the Asian nation repeatedly refused to accept mRNA vaccines from U.S.-based manufacturers. ""}, {""date"": ""20230705163400"", ""headline"": ""Merck & Co. Inc. stock underperforms Wednesday when compared to competitors"", ""summary"": ""Shares of Merck & Co. Inc. slid 0.55% to $113.70 Wednesday, on what proved to be an all-around grim trading session for the stock market, with the S&P 500...""}, {""date"": ""20230705204106"", ""headline"": ""Moderna announces China investment as country opens doors to foreign pharma"", ""summary"": ""China signals a warmer welcome for Western pharma giants just as Treasury Secretary Janey Yellen leaves for Beijing.""}, {""date"": ""20230706105000"", ""headline"": ""Broker Darlings of the Dow: Merck Ranks As a Top 15 Analyst Pick"", ""summary"": ""Looking for stock market analysis and research with proves results? Zacks.com offers in-depth financial research with over 30years of proven results.""}, {""date"": ""20230706105200"", ""headline"": ""Video: Dow Analyst Moves: MRK"", ""summary"": ""Looking for stock market analysis and research with proves results? Zacks.com offers in-depth financial research with over 30years of proven results.""}, {""date"": ""20230706140705"", ""headline"": ""Voya Global Equity Dividend: 9.2% Yield, What's Not To Like?"", ""summary"": ""The Voya Global Equity Dividend CEF generates a big yield. Read if this fund is a good way to play defense in a volatile market.""}, {""date"": ""20230706163400"", ""headline"": ""Merck & Co. Inc. stock underperforms Thursday when compared to competitors"", ""summary"": ""Shares of Merck & Co. Inc. slipped 1.72% to $111.75 Thursday, on what proved to be an all-around grim trading session for the stock market, with the S&P 500...""}, {""date"": ""20230707002929"", ""headline"": ""US unit of India's Cipla recalls six batches of bronchospasm inhaler"", ""summary"": ""Indian drugmaker Cipla\nsaid on Friday its U.S. unit was recalling six batches\nof albuterol sulfate inhalation aerosol due to a container\ndefect.\n              The company is initiating a recall in the...""}, {""date"": ""20230707094930"", ""headline"": ""Simcha Therapeutics Announces First Patient Dosed in Phase 1/2 Study Evaluating ST-067 in combination with KEYTRUDA in Patients with Various Solid Tumors"", ""summary"": ""NEW HAVEN - Simcha Therapeutics , a clinical-stage immunobiology company pioneering first-in-class cytokine treatments in cancer, today announced that the first patient has been dosed in a Phase 1/2...""}, {""date"": ""20230707115200"", ""headline"": ""Merck & Co Unusual Options Activity"", ""summary"": ""Looking for stock market analysis and research with proves results? Zacks.com offers in-depth financial research with over 30years of proven results.""}, {""date"": ""20230707154000"", ""headline"": ""Merck, Walmart share losses lead Dow's nearly 100-point fall"", ""summary"": ""The Dow Jones Industrial Average is trading down Friday afternoon with shares of Merck and Walmart delivering the stiffest headwinds for the price-weighted...""}, {""date"": ""20230707163032"", ""headline"": ""12 Best Momentum Stocks to Buy Today"", ""summary"": ""In this piece, we will take a look at the 12 best momentum stocks to buy today. If you want to skip our analysis of the stock market and the latest news, and want to take a look at the top five stocks in this list, then head on over to 5 Best Momentum Stocks [\u2026]""}, {""date"": ""20230707163400"", ""headline"": ""Merck & Co. Inc. stock underperforms Friday when compared to competitors"", ""summary"": ""Shares of Merck & Co. Inc. slipped 2.46% to $109.00 Friday, on what proved to be an all-around grim trading session for the stock market, with the S&P 500...""}, {""date"": ""20230707200038"", ""headline"": ""Retirement Stocks: Here\u2019s Where to Invest $1,000 Right Now"", ""summary"": ""Finding a \u201cgood\u201d retirement stock suitable for all investors\u2019 portfolios is nearly impossible. Variables depend on your retirement account\u2019s tax structure, age, risk tolerance, and personal investment preferences. Still, a solid retirement plan is diversified across multiple industries and offers exposure to various investments. Investors optimizing their retirement stock picks should look for companies with solid historical performance, future potential, and investor-friendly financials. Divide""}, {""date"": ""20230707202031"", ""headline"": ""25 US Companies With The Highest Profit Margins"", ""summary"": ""In this article, we will be taking a look at the 25 US companies with the highest profit margins. If you wish to see the top ones, head straight to the 5 US Companies With The Highest Profit Margins. In the dynamic landscape of the United States business sector, several companies like JP Morgan, Apple, [\u2026]""}, {""date"": ""20230708090000"", ""headline"": ""5 Relatively Safe And Cheap Dividend Stocks To Invest In - July 2023"", ""summary"": ""This is our monthly series where we highlight 5 companies that are large-cap, relatively safe, dividend-paying, with large discounts. Click for our exclusive list.""}, {""date"": ""20230709001953"", ""headline"": ""Merck: The Market Lacks Conviction To Take It Higher"", ""summary"": ""Merck's expensive valuation could discourage buyers from having the confidence in taking it higher. Click here to read my analysis of MRK stock.""}, {""date"": ""20230709110000"", ""headline"": ""Goldman Sachs sees rays of hope in underperforming health sector"", ""summary"": ""Looking for stock market analysis and research with proves results? Zacks.com offers in-depth financial research with over 30years of proven results.""}]",{}
1,2023-07-09,107.4836654663086,2023-07-16,105.84675598144531,-0.015229379066685977,D2,"[{""date"": ""20230709001953"", ""headline"": ""Merck: The Market Lacks Conviction To Take It Higher"", ""summary"": ""Merck's expensive valuation could discourage buyers from having the confidence in taking it higher. Click here to read my analysis of MRK stock.""}, {""date"": ""20230709110000"", ""headline"": ""Goldman Sachs sees rays of hope in underperforming health sector"", ""summary"": ""Looking for stock market analysis and research with proves results? Zacks.com offers in-depth financial research with over 30years of proven results.""}, {""date"": ""20230710014500"", ""headline"": ""B. Riley biotechnology analysts to hold an analyst/industry conference call"", ""summary"": ""Looking for stock market analysis and research with proves results? Zacks.com offers in-depth financial research with over 30years of proven results.""}, {""date"": ""20230710024858"", ""headline"": ""4 Factor Dividend Growth Portfolio - Cruising Towards A 20% Return"", ""summary"": ""The 4-factor dividend growth portfolio is a strategy that leverages the stock selection process of SCHD, with a few minor twists. Learn more about the strategy.""}, {""date"": ""20230710042800"", ""headline"": ""Affinity Asset Advisors, LLC Acquires Stake in Aeglea BioTherapeutics Inc"", ""summary"": ""Looking for stock market analysis and research with proves results? Zacks.com offers in-depth financial research with over 30years of proven results.""}, {""date"": ""20230710081800"", ""headline"": ""Novel Nanomedicine Platform With Pipeline Of Antivirals Goes To Human Trials \u2013 What Other Viruses Could This COVID Treatment Target?"", ""summary"": ""Looking for stock market analysis and research with proves results? Zacks.com offers in-depth financial research with over 30years of proven results.""}, {""date"": ""20230711071600"", ""headline"": ""Morgan Stanley Reaffirms Their Hold Rating on Merck & Company (MRK)"", ""summary"": ""Looking for stock market analysis and research with proves results? Zacks.com offers in-depth financial research with over 30years of proven results.""}, {""date"": ""20230711090500"", ""headline"": ""Athinia\u2122 expands partnerships to include Tokyo Electron for real-time collaborative analytics of semiconductor fab equipment performance"", ""summary"": ""Looking for stock market analysis and research with proves results? Zacks.com offers in-depth financial research with over 30years of proven results.""}, {""date"": ""20230711124400"", ""headline"": ""10 Health Care Stocks Whale Activity In Today's Session"", ""summary"": ""Looking for stock market analysis and research with proves results? Zacks.com offers in-depth financial research with over 30years of proven results.""}, {""date"": ""20230711154854"", ""headline"": ""Morgan Stanley Reiterates Merck (MRK) Equal-Weight Recommendation"", ""summary"": """"}, {""date"": ""20230711163400"", ""headline"": ""Merck & Co. Inc. stock underperforms Tuesday when compared to competitors"", ""summary"": ""Shares of Merck & Co. Inc. shed 1.15% to $108.70 Tuesday, on what proved to be an all-around favorable trading session for the stock market, with the S&P 500...""}, {""date"": ""20230711213325"", ""headline"": ""Joel Greenblatt\u2019s Return, Portfolio and Magic Formula"", ""summary"": ""In this article, we will discuss value investor Joel Greenblatt\u2019s portfolio, hedge fund returns, and his Magic Formula. You can skip our detailed analysis of Greenblatt\u2019s investment philosophy and his hedge fund\u2019s performance over the years, and go directly to read Joel Greenblatt\u2019s Top 5 Stock Picks. Joel Greenblatt, renowned for his expertise in value [\u2026]""}, {""date"": ""20230712010900"", ""headline"": ""Merck intensifies legal fight to halt Medicare drug pricing negotiations"", ""summary"": ""Looking for stock market analysis and research with proves results? Zacks.com offers in-depth financial research with over 30years of proven results.""}, {""date"": ""20230712032900"", ""headline"": ""Merck (MRK) Shares Cross Below 200 DMA"", ""summary"": ""Looking for stock market analysis and research with proves results? Zacks.com offers in-depth financial research with over 30years of proven results.""}, {""date"": ""20230712060000"", ""headline"": ""ClearBridge Small Cap Growth Strategy Q2 2023 Portfolio Manager Commentary"", ""summary"": ""The growth rally expanded to smaller stocks in the second quarter. Click here to read the full fund letter.""}, {""date"": ""20230712092000"", ""headline"": ""Peering Into Merck & Co's Recent Short Interest"", ""summary"": ""Looking for stock market analysis and research with proves results? Zacks.com offers in-depth financial research with over 30years of proven results.""}, {""date"": ""20230712113000"", ""headline"": ""MilliporeSigma Invests $25 Million to Expand Cell Culture Media Production in Kansas"", ""summary"": ""Looking for stock market analysis and research with proves results? Zacks.com offers in-depth financial research with over 30years of proven results.""}, {""date"": ""20230712125600"", ""headline"": ""Bernie Sanders Doesn't Own Individual Stocks But His Mutual Fund Holdings Include Stakes In Companies He's Criticized, Including Tesla"", ""summary"": ""Looking for stock market analysis and research with proves results? Zacks.com offers in-depth financial research with over 30years of proven results.""}, {""date"": ""20230712163400"", ""headline"": ""Merck & Co. Inc. stock underperforms Wednesday when compared to competitors"", ""summary"": ""Shares of Merck & Co. Inc. shed 1.13% to $107.47 Wednesday, on what proved to be an all-around positive trading session for the stock market, with the S&P...""}, {""date"": ""20230712171011"", ""headline"": ""Chamber of Commerce asks judge to block Medicare drug price negotiations before October"", ""summary"": ""The U.S. Chamber of Commerce asked a judge to block the landmark ability of Medicare to negotiate drug prices. ""}, {""date"": ""20230713021500"", ""headline"": ""Calliditas interim phase 2 data positive for head and neck cancer asset setanaxib"", ""summary"": ""Looking for stock market analysis and research with proves results? Zacks.com offers in-depth financial research with over 30years of proven results.""}, {""date"": ""20230713103800"", ""headline"": ""See Which Of The Latest 13F Filers Holds Merck"", ""summary"": ""Looking for stock market analysis and research with proves results? Zacks.com offers in-depth financial research with over 30years of proven results.""}, {""date"": ""20230713115000"", ""headline"": ""Big Pharma Ramps Up Fight Against Medicare Price Negotiations"", ""summary"": ""The U.S. Chamber of Commerce asked a judge to stop the federal government from putting into effect a law that will allow Medicare to negotiate the prices of...""}, {""date"": ""20230713120400"", ""headline"": ""3 Penny Stocks to Catapult You Into the Millionaires\u2019 Club"", ""summary"": ""Looking for stock market analysis and research with proves results? Zacks.com offers in-depth financial research with over 30years of proven results.""}, {""date"": ""20230713163400"", ""headline"": ""Merck & Co. Inc. stock falls Thursday, underperforms market"", ""summary"": ""Shares of Merck & Co. Inc. shed 1.07% to $106.32 Thursday, on what proved to be an all-around favorable trading session for the stock market, with the S&P...""}, {""date"": ""20230713200849"", ""headline"": ""15 Deadliest Cancers in the U.S."", ""summary"": ""In this article, we will discuss the 15 deadliest cancers in the U.S. To skip our detailed analysis and recent updates regarding cancer research and the oncology market, go directly to the 5 Deadliest Cancers in the U.S. Cancer stands as a pervasive, highly destructive, and agonizing disease, with a significant global impact. Cancer, also [\u2026]""}, {""date"": ""20230714024254"", ""headline"": ""My Dividend Growth Portfolio - Q2 2023 Summary"", ""summary"": ""In 2015, I started publishing updates regarding my dividend growth portfolio, and I keep doing so every quarter. Read here for a summary of Q2 of 2023.""}, {""date"": ""20230714034100"", ""headline"": ""Merck initiated with a Hold at HSBC"", ""summary"": ""Looking for stock market analysis and research with proves results? Zacks.com offers in-depth financial research with over 30years of proven results.""}, {""date"": ""20230714034500"", ""headline"": ""Why Are Dow Stocks Up Today?"", ""summary"": ""Looking for stock market analysis and research with proves results? Zacks.com offers in-depth financial research with over 30years of proven results.""}, {""date"": ""20230714035503"", ""headline"": ""Nicholas Ward's Dividend Growth Portfolio: June 2023 Review"", ""summary"": ""The significant dividend growth is attributed to rapid rise in interest rates over past 12-18 months, with cash position now yielding nearly 5%. Read more here.""}, {""date"": ""20230714094500"", ""headline"": ""Dow up 130 points on gains in shares of UnitedHealth, JPMorgan Chase"", ""summary"": ""The Dow Jones Industrial Average is trading up Friday morning with shares of UnitedHealth and JPMorgan Chase delivering the strongest returns for the index....""}, {""date"": ""20230714100800"", ""headline"": ""Benzinga's Top Ratings Upgrades, Downgrades For July 14, 2023"", ""summary"": ""Looking for stock market analysis and research with proves results? Zacks.com offers in-depth financial research with over 30years of proven results.""}, {""date"": ""20230714124100"", ""headline"": ""10 Health Care Stocks With Whale Alerts In Today's Session"", ""summary"": ""Looking for stock market analysis and research with proves results? Zacks.com offers in-depth financial research with over 30years of proven results.""}, {""date"": ""20230714163400"", ""headline"": ""Merck & Co. Inc. stock outperforms competitors on strong trading day"", ""summary"": ""Shares of Merck & Co. Inc. inched 0.96% higher to $107.34 Friday, on what proved to be an all-around mixed trading session for the stock market, with the Dow...""}, {""date"": ""20230714165437"", ""headline"": ""More Challenges Await AbbVie Following A Disappointing Quarter"", ""summary"": ""AbbVie Inc., one of the leaders in the global immunology market, will release its financial report for the second quarter of 2023. Click here to read more.""}, {""date"": ""20230714213534"", ""headline"": ""HSBC Initiates Coverage of Merck (MRK) with Hold Recommendation"", ""summary"": """"}, {""date"": ""20230715093100"", ""headline"": ""Why You Should Aim For $3 Million For Retirement (Gen X'ers And Millennials)"", ""summary"": ""Saving early and regularly, investing wisely, and budgeting expenses are keys to a wealthy retirement. Read why it's a good time for younger generations to look at retirement scenarios.""}]",{}
