,Start Date,Start Price,End Date,End Price,Weekly Returns,Bin Label,News,Basics
18,2023-11-05,167.49038696289062,2023-11-12,169.03192138671875,0.009203718803095562,U1,"[{""date"": ""20231106165500"", ""headline"": ""Travelers Cos. Inc. stock outperforms market on strong trading day"", ""summary"": ""Shares of Travelers Cos. Inc. inched 0.68% higher to $169.55 Monday, on what proved to be an all-around positive trading session for the stock market, with...""}, {""date"": ""20231107165500"", ""headline"": ""Travelers Cos. Inc. stock rises Tuesday, still underperforms market"", ""summary"": ""Shares of Travelers Cos. Inc. inched 0.26% higher to $169.99 Tuesday, on what proved to be an all-around positive trading session for the stock market, with...""}, {""date"": ""20231108094000"", ""headline"": ""Video: Dow Movers: TRV, CAT"", ""summary"": ""Looking for stock market analysis and research with proves results? Zacks.com offers in-depth financial research with over 30years of proven results.""}, {""date"": ""20231108165500"", ""headline"": ""Travelers Cos. Inc. stock falls Wednesday, underperforms market"", ""summary"": ""Shares of Travelers Cos. Inc. slipped 0.84% to $168.56 Wednesday, on what proved to be an all-around mixed trading session for the stock market, with the S&P...""}, {""date"": ""20231108181409"", ""headline"": ""12 Best Undervalued Dividend Stocks To Buy Now"", ""summary"": ""In this article, we discuss 12 best undervalued dividend stocks to buy now. You can skip our detailed analysis of undervalued dividend stocks and their performance in the past, and go directly to read 5 Best Undervalued Dividend Stocks To Buy Now. Historical data reveals that the performance of growth stocks and value stocks has [\u2026]""}, {""date"": ""20231109165500"", ""headline"": ""Travelers Cos. Inc. stock rises Thursday, outperforms market"", ""summary"": ""Shares of Travelers Cos. Inc. inched 0.02% higher to $168.59 Thursday, on what proved to be an all-around dismal trading session for the stock market, with...""}, {""date"": ""20231110165500"", ""headline"": ""Travelers Cos. Inc. stock rises Friday, still underperforms market"", ""summary"": ""Shares of Travelers Cos. Inc. inched 0.81% higher to $169.96 Friday, on what proved to be an all-around great trading session for the stock market, with the...""}]",{}
19,2023-11-12,169.03192138671875,2023-11-19,170.8817596435547,0.010943721408714246,U2,"[{""date"": ""20231113104700"", ""headline"": ""See How Travelers Companies Ranks Among Analysts' Top Dow 30 Picks"", ""summary"": ""Looking for stock market analysis and research with proves results? Zacks.com offers in-depth financial research with over 30years of proven results.""}, {""date"": ""20231113104700"", ""headline"": ""Video: Dow Analyst Moves: TRV"", ""summary"": ""Looking for stock market analysis and research with proves results? Zacks.com offers in-depth financial research with over 30years of proven results.""}, {""date"": ""20231113140000"", ""headline"": ""Travelers Recognized for Military-Friendly Culture"", ""summary"": ""HARTFORD, Conn., November 13, 2023--The Travelers Companies, Inc. (NYSE: TRV) today announced it has once again been named a Military Friendly\u00ae Employer and Military Spouse Friendly\u00ae Employer by VIQTORY. The company also maintained its status as a Military Times Best for Vets Employer.""}, {""date"": ""20231114000505"", ""headline"": ""13 Cheap Blue Chip Stocks To Buy"", ""summary"": ""In this piece, we will take a look at the 13 cheap blue chip stocks to buy. To skip our overview of the blue chip sector and the latest news about the stock market, take a look at the 5 Cheap Blue Chip Stocks To Buy. Within the American stock market, the Dow Jones Industrial [\u2026]""}, {""date"": ""20231114092700"", ""headline"": ""Video: Dow Movers: TRV, HD"", ""summary"": ""Looking for stock market analysis and research with proves results? Zacks.com offers in-depth financial research with over 30years of proven results.""}, {""date"": ""20231114165500"", ""headline"": ""Travelers Cos. Inc. stock underperforms Tuesday when compared to competitors"", ""summary"": ""Shares of Travelers Cos. Inc. shed 1.35% to $168.70 Tuesday, on what proved to be an all-around positive trading session for the stock market, with the S&P...""}, {""date"": ""20231115030800"", ""headline"": ""Travelers initiated with a Perform at Oppenheimer"", ""summary"": ""Looking for stock market analysis and research with proves results? Zacks.com offers in-depth financial research with over 30years of proven results.""}, {""date"": ""20231115165500"", ""headline"": ""Travelers Cos. Inc. stock outperforms competitors on strong trading day"", ""summary"": ""Shares of Travelers Cos. Inc. inched 0.50% higher to $169.54 Wednesday, on what proved to be an all-around favorable trading session for the stock market,...""}, {""date"": ""20231116060500"", ""headline"": ""Analyst Expectations for Travelers Companies's Future"", ""summary"": ""Looking for stock market analysis and research with proves results? Zacks.com offers in-depth financial research with over 30years of proven results.""}, {""date"": ""20231116063500"", ""headline"": ""Auxier Asset Management Fall 2023 Market Commentary"", ""summary"": ""Auxier Focus Fund\u00e2\u0080\u0099s Investor Class declined 2.28% in Q3 2023 vs. S&P 500 cap-weighted index decline of 3.27%. Click here to read the full fund letter.""}, {""date"": ""20231116104400"", ""headline"": ""THG, SIGI, HCI nab Outperform ratings as Oppenheimer starts coverage"", ""summary"": ""Looking for stock market analysis and research with proves results? Zacks.com offers in-depth financial research with over 30years of proven results.""}, {""date"": ""20231116111000"", ""headline"": ""Interesting TRV Put And Call Options For July 2024"", ""summary"": ""Looking for stock market analysis and research with proves results? Zacks.com offers in-depth financial research with over 30years of proven results.""}, {""date"": ""20231116112700"", ""headline"": ""TRV Crosses Above Key Moving Average Level"", ""summary"": ""Looking for stock market analysis and research with proves results? Zacks.com offers in-depth financial research with over 30years of proven results.""}, {""date"": ""20231116165600"", ""headline"": ""Travelers Cos. Inc. stock outperforms market on strong trading day"", ""summary"": ""Shares of Travelers Cos. Inc. rallied 1.27% to $171.69 Thursday, on what proved to be an all-around mixed trading session for the stock market, with the S&P...""}, {""date"": ""20231116190150"", ""headline"": ""Oppenheimer Initiates Coverage of Travelers Companies (TRV) with Perform Recommendation"", ""summary"": """"}, {""date"": ""20231117022000"", ""headline"": ""Looking Into Travelers Companies's Recent Short Interest"", ""summary"": ""Looking for stock market analysis and research with proves results? Zacks.com offers in-depth financial research with over 30years of proven results.""}, {""date"": ""20231117163025"", ""headline"": ""Why Is Travelers (TRV) Up 4.7% Since Last Earnings Report?"", ""summary"": ""Travelers (TRV) reported earnings 30 days ago. What's next for the stock? We take a look at earnings estimates for some clues.""}, {""date"": ""20231117165600"", ""headline"": ""Travelers Cos. Inc. stock rises Friday, still underperforms market"", ""summary"": ""Shares of Travelers Cos. Inc. inched 0.08% higher to $171.82 Friday, on what proved to be an all-around great trading session for the stock market, with the...""}]",{}
20,2023-11-19,170.8817596435547,2023-11-26,176.5705108642578,0.03329057023154136,U4,"[{""date"": ""20231120032600"", ""headline"": ""The Travelers Companies Inc(TRV) 2022 Chairman and CEO Alan D. ..."", ""summary"": ""Looking for stock market analysis and research with proves results? Zacks.com offers in-depth financial research with over 30years of proven results.""}, {""date"": ""20231120035700"", ""headline"": ""Travelers Cos. Inc. stock rises Monday, still underperforms market"", ""summary"": ""Looking for stock market analysis and research with proves results? Zacks.com offers in-depth financial research with over 30years of proven results.""}, {""date"": ""20231120091500"", ""headline"": ""Travelers Looks Like Will Make A Double Correction Lower."", ""summary"": ""Looking for stock market analysis and research with proves results? Zacks.com offers in-depth financial research with over 30years of proven results.""}, {""date"": ""20231121035700"", ""headline"": ""Travelers Cos. Inc. stock outperforms market on strong trading day"", ""summary"": ""Looking for stock market analysis and research with proves results? Zacks.com offers in-depth financial research with over 30years of proven results.""}, {""date"": ""20231122035700"", ""headline"": ""Travelers Cos. Inc. stock underperforms Wednesday when compared to competitors despite daily gains"", ""summary"": ""Looking for stock market analysis and research with proves results? Zacks.com offers in-depth financial research with over 30years of proven results.""}, {""date"": ""20231122220156"", ""headline"": ""15 States with the Most Expensive Car Insurance in the US"", ""summary"": ""In this article, we will look at the top 15 states with the most expensive car insurance in the US. If you want to skip our detailed analysis of the car insurance industry, you can go to the Top 5 States with the Most Expensive Car Insurance in the US. The car insurance market is [\u2026]""}, {""date"": ""20231124035600"", ""headline"": ""Travelers Cos. Inc. stock outperforms competitors on strong trading day"", ""summary"": ""Looking for stock market analysis and research with proves results? Zacks.com offers in-depth financial research with over 30years of proven results.""}, {""date"": ""20231125040000"", ""headline"": ""3 Dividend-Paying P&C Insurers That Promise Steady Returns"", ""summary"": ""Looking for stock market analysis and research with proves results? Zacks.com offers in-depth financial research with over 30years of proven results.""}]",{}
21,2023-11-26,176.5705108642578,2023-12-03,180.98626708984375,0.025008458116659416,U3,"[{""date"": ""20231127084500"", ""headline"": ""Zacks Industry Outlook Highlights Chubb Limited, Cincinnati Financial and The Travelers Companies"", ""summary"": ""Chubb Limited, Cincinnati Financial and The Travelers Companies have been highlighted in this Industry Outlook article.""}, {""date"": ""20231127114000"", ""headline"": ""10 Financials Stocks With Whale Alerts In Today's Session"", ""summary"": ""Looking for stock market analysis and research with proves results? Zacks.com offers in-depth financial research with over 30years of proven results.""}, {""date"": ""20231128165500"", ""headline"": ""Travelers Cos. Inc. stock falls Tuesday, underperforms market"", ""summary"": ""Shares of Travelers Cos. Inc. shed 0.99% to $176.84 Tuesday, on what proved to be an all-around favorable trading session for the stock market, with the S&P...""}, {""date"": ""20231130051105"", ""headline"": ""AM Best Revises Outlooks to Positive; Affirms Credit Ratings of Junto Resseguros S.A. and Junto Seguros S.A"", ""summary"": ""AM Best has revised the outlooks to positive from stable and affirmed the Financial Strength Rating of A- and the Long-Term Issuer Credit Ratings of 'a-' of Junto Resseguros S.A. and Junto...""}, {""date"": ""20231130165500"", ""headline"": ""Travelers Cos. Inc. stock rises Thursday, outperforms market"", ""summary"": ""Shares of Travelers Cos. Inc. rallied 1.79% to $180.62 Thursday, on what proved to be an all-around positive trading session for the stock market, with the...""}, {""date"": ""20231201124700"", ""headline"": ""Should You Retain Travelers (TRV) Stock in Your Portfolio?"", ""summary"": ""Travelers (TRV) is poised to benefit from strong net earned premiums, higher average levels of invested assets, improved results from the fixed-income portfolio and prudent capital deployment.""}, {""date"": ""20231201165500"", ""headline"": ""Travelers Cos. Inc. stock outperforms market on strong trading day"", ""summary"": ""Shares of Travelers Cos. Inc. inched 0.75% higher to $181.98 Friday, on what proved to be an all-around great trading session for the stock market, with the...""}, {""date"": ""20231202122112"", ""headline"": ""There's A Lot To Like About Travelers Companies' (NYSE:TRV) Upcoming US$1.00 Dividend"", ""summary"": ""Some investors rely on dividends for growing their wealth, and if you're one of those dividend sleuths, you might be...""}, {""date"": ""20231202125500"", ""headline"": ""Allstate: 5 Reasons Why I Am Bullish"", ""summary"": ""Looking for stock market analysis and research with proves results? Zacks.com offers in-depth financial research with over 30years of proven results.""}, {""date"": ""20231203071023"", ""headline"": ""Dividend Champion, Contender, And Challenger Highlights: Week Of December 3"", ""summary"": ""A weekly summary of dividend activity for Dividend Champions, Contenders, and Challengers. Read more to see the update for the week of December 3.""}]",{}
22,2023-12-03,180.98626708984375,2023-12-10,181.25999450683594,0.001512420922280766,U1,"[{""date"": ""20231203071023"", ""headline"": ""Dividend Champion, Contender, And Challenger Highlights: Week Of December 3"", ""summary"": ""A weekly summary of dividend activity for Dividend Champions, Contenders, and Challengers. Read more to see the update for the week of December 3.""}, {""date"": ""20231204165500"", ""headline"": ""Travelers Cos. Inc. stock rises Monday, outperforms market"", ""summary"": ""Shares of Travelers Cos. Inc. inched 0.66% higher to $183.19 Monday, on what proved to be an all-around rough trading session for the stock market, with the...""}, {""date"": ""20231205114900"", ""headline"": ""Looking Into Travelers Companies's Recent Short Interest"", ""summary"": ""Looking for stock market analysis and research with proves results? Zacks.com offers in-depth financial research with over 30years of proven results.""}, {""date"": ""20231205165500"", ""headline"": ""Travelers Cos. Inc. stock rises Tuesday, outperforms market"", ""summary"": ""Shares of Travelers Cos. Inc. inched 0.26% higher to $183.66 Tuesday, on what proved to be an all-around poor trading session for the stock market, with the...""}, {""date"": ""20231205170200"", ""headline"": ""TRV or ALL: Which P&C Insurance Stock Has an Edge Now?"", ""summary"": ""Let's see how Travelers Companies (TRV) and Allstate Corporation (ALL) fare in terms of some of the key metrics.""}, {""date"": ""20231206101022"", ""headline"": ""The Travelers Companies Inc's Dividend Analysis"", ""summary"": ""The Travelers Companies Inc (NYSE:TRV) recently announced a dividend of $1 per share, payable on 2023-12-29, with the ex-dividend date set for 2023-12-07.  As investors look forward to this upcoming payment, the spotlight also shines on the company's dividend history, yield, and growth rates.  Using the data from GuruFocus, let's look into The Travelers Companies Inc's dividend performance and assess its sustainability.""}, {""date"": ""20231206160500"", ""headline"": ""4 Low-Beta P&C Insurance Stocks to Beat Volatile Market"", ""summary"": ""Here we pick four low-beta stocks, ACGL, ALL, TRV and AXS, that are poised to deliver steady performance irrespective of market conditions.""}, {""date"": ""20231207165500"", ""headline"": ""Travelers Cos. Inc. stock outperforms competitors despite losses on the day"", ""summary"": ""Shares of Travelers Cos. Inc. shed 0.12% to $181.91 Thursday, on what proved to be an all-around favorable trading session for the stock market, with the S&P...""}, {""date"": ""20231207224131"", ""headline"": ""20 States Where Car Insurance Costs The Least"", ""summary"": ""In this article, we will look at 20 states where car insurance costs the least. If you want to skip our detailed analysis of the motor insurance market in the US, you can go directly to 5 States Where Car Insurance Costs The Least. The US Motor Insurance Market at a Glance The US motor [\u2026]""}, {""date"": ""20231208165400"", ""headline"": ""Travelers Cos. Inc. stock underperforms Friday when compared to competitors"", ""summary"": ""Shares of Travelers Cos. Inc. dropped 0.36% to $181.26 Friday, on what proved to be an all-around great trading session for the stock market, with the S&P...""}, {""date"": ""20231209001730"", ""headline"": ""The Travelers Companies: An Attractive Value Play"", ""summary"": ""Travelers Companies faced challenges in 2023 but is expected to regain profitability in 2024, with a strong dividend history and attractive valuation. Read more here.""}, {""date"": ""20231209193736"", ""headline"": ""15 Best Business Insurance Companies Heading into 2024"", ""summary"": ""In this article, we will take a look at the 15 best business insurance companies heading into 2024. If you want to skip our detailed analysis, you can go directly to 5 Best Business Insurance Companies Heading into 2024. The Future of Business Insurance According to a report by Deloitte, the future of business insurance is [\u2026]""}]",{}
23,2023-12-10,181.25999450683594,2023-12-17,182.80999755859375,0.00855126944020368,U1,"[{""date"": ""20231211092300"", ""headline"": ""What's Driving Allstate Corp's Surprising 32% Stock Rally?"", ""summary"": ""Looking for stock market analysis and research with proves results? Zacks.com offers in-depth financial research with over 30years of proven results.""}, {""date"": ""20231211093700"", ""headline"": ""Top growth stocks for those wary of valuations - Goldman"", ""summary"": ""Looking for stock market analysis and research with proves results? Zacks.com offers in-depth financial research with over 30years of proven results.""}, {""date"": ""20231211165500"", ""headline"": ""Travelers Cos. Inc. stock underperforms Monday when compared to competitors despite daily gains"", ""summary"": ""Shares of Travelers Cos. Inc. inched 0.60% higher to $182.35 Monday, on what proved to be an all-around great trading session for the stock market, with the...""}, {""date"": ""20231212140000"", ""headline"": ""Travelers Named a Leader in LGBTQ+ Workplace Inclusion"", ""summary"": ""HARTFORD, Conn., December 12, 2023--The Travelers Companies, Inc. (NYSE: TRV) today announced it has once again received a score of 100 on the Corporate Equality Index (CEI), earning the Equality 100 Award and named a Leader in LGBTQ+ Workplace Inclusion. Administered by the Human Rights Campaign Foundation, the CEI is the nation\u2019s foremost benchmarking survey and report measuring corporate policies and practices related to LGBTQ+ workplace equality.""}, {""date"": ""20231212165500"", ""headline"": ""Travelers Cos. Inc. stock rises Tuesday, outperforms market"", ""summary"": ""Shares of Travelers Cos. Inc. inched 0.72% higher to $183.66 Tuesday, on what proved to be an all-around favorable trading session for the stock market, with...""}, {""date"": ""20231213130241"", ""headline"": ""15 Best Manufactured Home Insurance Companies Heading into 2024"", ""summary"": ""In this article, we will take a look at the 15 best manufactured home insurance companies heading into 2024. If you want to skip our detailed analysis, you can go directly to 5 Best Manufactured Home Insurance Companies Heading into 2024. The Home Insurance Industry: An Outlook According to a report by Forbes, extreme weather [\u2026]""}, {""date"": ""20231213130514"", ""headline"": ""15 Best Known Car Insurance Companies Heading into 2024"", ""summary"": ""In this article, we will take a look at the 15 best known car insurance companies heading into 2024. If you want to skip our detailed analysis, you can go directly to 5 Best Known Car Insurance Companies Heading into 2024. The Car Insurance Industry: At a Glance According to a report by Forbes, auto [\u2026]""}, {""date"": ""20231213152813"", ""headline"": ""15 Best Property and Casualty Insurance Companies Heading into 2024"", ""summary"": ""In this article, we will take a look at the 15 best property and casualty insurance companies heading into 2024. If you want to skip our detailed analysis, you can go directly to the 5 Best Property and Casualty Insurance Companies Heading into 2024. The Global Property and Casualty Insurance Industry: A Market Analysis According [\u2026]""}, {""date"": ""20231213165500"", ""headline"": ""Travelers Cos. Inc. stock rises Wednesday, still underperforms market"", ""summary"": ""Shares of Travelers Cos. Inc. inched 0.85% higher to $185.22 Wednesday, on what proved to be an all-around great trading session for the stock market, with...""}, {""date"": ""20231214111600"", ""headline"": ""Video: Dow Movers: TRV, WBA"", ""summary"": ""Looking for stock market analysis and research with proves results? Zacks.com offers in-depth financial research with over 30years of proven results.""}, {""date"": ""20231214114400"", ""headline"": ""Interesting TRV Put And Call Options For February 2024"", ""summary"": ""Looking for stock market analysis and research with proves results? Zacks.com offers in-depth financial research with over 30years of proven results.""}, {""date"": ""20231214140000"", ""headline"": ""Travelers Schedules Conference Call to Review Fourth Quarter 2023 Results"", ""summary"": ""NEW YORK, December 14, 2023--The Travelers Companies, Inc. (NYSE: TRV) will review its fourth quarter and full year 2023 results at 9 a.m. ET on Friday, Jan. 19, following the release of results earlier that morning.""}, {""date"": ""20231214165400"", ""headline"": ""Travelers Cos. Inc. stock outperforms competitors despite losses on the day"", ""summary"": ""Shares of Travelers Cos. Inc. slid 1.32% to $182.77 Thursday, on what proved to be an all-around great trading session for the stock market, with the S&P 500...""}, {""date"": ""20231215035600"", ""headline"": ""Travelers Cos. Inc. stock outperforms competitors on strong trading day"", ""summary"": ""Looking for stock market analysis and research with proves results? Zacks.com offers in-depth financial research with over 30years of proven results.""}]",{}
