,Start Date,Start Price,End Date,End Price,Weekly Returns,Bin Label,News,Basics
5,2023-08-06,166.6847381591797,2023-08-13,164.9156036376953,-0.010613656301244001,D2,"[{""date"": ""20230807165600"", ""headline"": ""Travelers Cos. Inc. stock rises Monday, still underperforms market"", ""summary"": ""Shares of Travelers Cos. Inc. inched 0.87% higher to $170.12 Monday, on what proved to be an all-around favorable trading session for the stock market, with...""}, {""date"": ""20230808165600"", ""headline"": ""Travelers Cos. Inc. stock falls Tuesday, underperforms market"", ""summary"": ""Shares of Travelers Cos. Inc. shed 1.32% to $167.88 Tuesday, on what proved to be an all-around rough trading session for the stock market, with the S&P 500...""}, {""date"": ""20230808192318"", ""headline"": ""Buy 2 August Dogs Of The Dow, Watch 5"", ""summary"": ""Discover the criteria for stocks to be added to the Dow, the highest-yield stocks in August, and analyst predictions for stocks' performance. Read more here.""}, {""date"": ""20230809165600"", ""headline"": ""Travelers Cos. Inc. stock outperforms market despite losses on the day"", ""summary"": ""Shares of Travelers Cos. Inc. slid 0.35% to $167.29 Wednesday, on what proved to be an all-around dismal trading session for the stock market, with the S&P...""}, {""date"": ""20230810123600"", ""headline"": ""Should You Retain Travelers (TRV) Stock in Your Portfolio?"", ""summary"": ""Travelers (TRV) stands to gain from strong returns from the non-fixed income portfolio, positive renewal premium change, high levels of retention and effective capital deployment.""}, {""date"": ""20230810165600"", ""headline"": ""Travelers Cos. Inc. stock falls Thursday, underperforms market"", ""summary"": ""Shares of Travelers Cos. Inc. slipped 0.21% to $166.94 Thursday, on what proved to be an all-around positive trading session for the stock market, with the...""}, {""date"": ""20230811035700"", ""headline"": ""Travelers Cos. Inc. stock falls Friday, still outperforms market"", ""summary"": ""Looking for stock market analysis and research with proves results? Zacks.com offers in-depth financial research with over 30years of proven results.""}, {""date"": ""20230811215945"", ""headline"": ""12 Undervalued Blue Chip Stocks To Buy According to Wall Street Analysts"", ""summary"": ""In this piece, we will take a look at 12 undervalued blue chip stocks to buy according to Wall Street analysts. If you want to skip our introduction to blue chip stocks, then take a look at 5 Undervalued Blue Chip Stocks To Buy According to Wall Street Analysts. The stock market is made up [\u2026]""}, {""date"": ""20230812083000"", ""headline"": ""TRV: This Blue-Chip Stock Is Cheap Now"", ""summary"": ""Looking for stock market analysis and research with proves results? Zacks.com offers in-depth financial research with over 30years of proven results.""}]",{}
6,2023-08-13,164.9156036376953,2023-08-20,160.57675170898438,-0.02630952943811793,D3,"[{""date"": ""20230814035700"", ""headline"": ""Travelers Cos. Inc. stock underperforms Monday when compared to competitors"", ""summary"": ""Looking for stock market analysis and research with proves results? Zacks.com offers in-depth financial research with over 30years of proven results.""}, {""date"": ""20230815035700"", ""headline"": ""Travelers Cos. Inc. stock falls Tuesday, underperforms market"", ""summary"": ""Looking for stock market analysis and research with proves results? Zacks.com offers in-depth financial research with over 30years of proven results.""}, {""date"": ""20230815180305"", ""headline"": ""Stock futures are little changed as Wall Street looks beyond losing session: Live updates"", ""summary"": ""All three major indexes ended Tuesday's session more than 1% lower.""}, {""date"": ""20230816035700"", ""headline"": ""Travelers Cos. Inc. stock outperforms market on strong trading day"", ""summary"": ""Looking for stock market analysis and research with proves results? Zacks.com offers in-depth financial research with over 30years of proven results.""}, {""date"": ""20230816111200"", ""headline"": ""Dow Breaks Morning Silence, Up Triple Digits"", ""summary"": ""Looking for stock market analysis and research with proves results? Zacks.com offers in-depth financial research with over 30years of proven results.""}, {""date"": ""20230816142926"", ""headline"": ""Insurance Stocks Rise After Strong Progressive Results"", ""summary"": ""Good news from Progressive is giving insurance stocks a lift. Progressive shares rose some 8% after the insurer said it wrote $5.95 billion worth of premiums in July, up 21% from a year ago. That made the stock the S&P 500\u2019s top performer as of midmorning Wednesday.""}, {""date"": ""20230817165600"", ""headline"": ""Travelers Cos. Inc. stock underperforms Thursday when compared to competitors"", ""summary"": ""Shares of Travelers Cos. Inc. shed 1.19% to $163.41 Thursday, on what proved to be an all-around rough trading session for the stock market, with the S&P 500...""}, {""date"": ""20230818165600"", ""headline"": ""Travelers Cos. Inc. stock underperforms Friday when compared to competitors"", ""summary"": ""Shares of Travelers Cos. Inc. slipped 0.58% to $162.47 Friday, on what proved to be an all-around mixed trading session for the stock market, with the Dow...""}]",{}
7,2023-08-20,160.57675170898438,2023-08-27,159.75643920898438,-0.005108538385971695,D1,"[{""date"": ""20230821165600"", ""headline"": ""Travelers Cos. Inc. stock falls Monday, underperforms market"", ""summary"": ""Shares of Travelers Cos. Inc. dropped 0.54% to $161.60 Monday, on what proved to be an all-around mixed trading session for the stock market, with the S&P...""}, {""date"": ""20230822165448"", ""headline"": ""Best Stocks To Buy Today? 2 Dow Jones Stocks To Know"", ""summary"": ""Dow Jones stocks to check out in the stock market now.""}, {""date"": ""20230822165600"", ""headline"": ""Travelers Cos. Inc. stock falls Tuesday, underperforms market"", ""summary"": ""Shares of Travelers Cos. Inc. slipped 1.03% to $159.94 Tuesday, on what proved to be an all-around poor trading session for the stock market, with the S&P...""}, {""date"": ""20230823165600"", ""headline"": ""Travelers Cos. Inc. stock rises Wednesday, still underperforms market"", ""summary"": ""Shares of Travelers Cos. Inc. inched 0.62% higher to $160.93 Wednesday, on what proved to be an all-around positive trading session for the stock market,...""}, {""date"": ""20230824093000"", ""headline"": ""VinFast soars again and trades at a higher market cap than Walgreens or Goldman Sachs"", ""summary"": ""Looking for stock market analysis and research with proves results? Zacks.com offers in-depth financial research with over 30years of proven results.""}, {""date"": ""20230824133800"", ""headline"": ""5 P&C Insurance Stocks With Modest Dividend Yield to Watch"", ""summary"": ""Here we pick five insurance stocks -- Axis Capital (AXS), American Financial (AFG), First American Financial (FAF), Travelers (TRV) and CNA Financial (CNA) -- with a solid five-year dividend growth history.""}, {""date"": ""20230824165600"", ""headline"": ""Travelers Cos. Inc. stock outperforms competitors on strong trading day"", ""summary"": ""Shares of Travelers Cos. Inc. inched 0.57% higher to $161.84 Thursday, on what proved to be an all-around grim trading session for the stock market, with the...""}, {""date"": ""20230825013000"", ""headline"": ""The Big Reason Your Insurance Is Getting More Expensive"", ""summary"": ""Backed by nearly $1 trillion in capital and rising premiums, insurers might profit from the coming catastrophic weather.""}, {""date"": ""20230825170200"", ""headline"": ""Travelers Cos. Inc. stock falls Friday, underperforms market"", ""summary"": ""Shares of Travelers Cos. Inc. slumped 0.12% to $161.64 Friday, on what proved to be an all-around favorable trading session for the stock market, with the...""}, {""date"": ""20230827102100"", ""headline"": ""It\u2019s a Good Time to Invest in Insurers. This ETF Is a Way to Play the Trend."", ""summary"": ""Property and casualty insurers are hiking premium rates to cover future losses. That bodes well for future profitability.""}]",{}
8,2023-08-27,159.75643920898438,2023-09-03,160.40875244140625,0.004083173333430112,U1,"[{""date"": ""20230827102100"", ""headline"": ""It\u2019s a Good Time to Invest in Insurers. This ETF Is a Way to Play the Trend."", ""summary"": ""Property and casualty insurers are hiking premium rates to cover future losses. That bodes well for future profitability.""}, {""date"": ""20230828104600"", ""headline"": ""See How Travelers Companies Ranks Among Analysts' Top Dow 30 Picks"", ""summary"": ""Looking for stock market analysis and research with proves results? Zacks.com offers in-depth financial research with over 30years of proven results.""}, {""date"": ""20230828104900"", ""headline"": ""Video: Dow Analyst Moves: TRV"", ""summary"": ""Looking for stock market analysis and research with proves results? Zacks.com offers in-depth financial research with over 30years of proven results.""}, {""date"": ""20230828125905"", ""headline"": ""Dow 30 Stocks List: Ranked By Hedge Fund Bullishness Index"", ""summary"": ""In this article, we discuss Dow 30 stocks ranked in accordance with the hedge fund bullishness index. If you want to skip our detailed discussion about the stock market performance, head directly to Top 10 Dow Stocks: Ranked By Hedge Fund Bullishness Index. Dow 30 is a stock index that takes into consideration the performance [\u2026]""}, {""date"": ""20230828165600"", ""headline"": ""Travelers Cos. Inc. stock falls Monday, underperforms market"", ""summary"": ""Shares of Travelers Cos. Inc. slipped 0.50% to $160.83 Monday, on what proved to be an all-around positive trading session for the stock market, with the S&P...""}, {""date"": ""20230829130000"", ""headline"": ""Travelers Institute\u00ae Announces Fall 2023 Cybersecurity Education Tour"", ""summary"": ""HARTFORD, Conn., August 29, 2023--The Travelers Institute, the public policy division of The Travelers Companies, Inc. (NYSE: TRV), today announced its fall cybersecurity education tour, part of its Cyber: Prepare, Prevent, Mitigate, Restore\u00ae series. Educational programs will be hosted in six cities across the United States, offering best practices for effectively preparing for and managing cyber incidents.""}, {""date"": ""20230829165700"", ""headline"": ""Travelers Cos. Inc. stock rises Tuesday, still underperforms market"", ""summary"": ""Shares of Travelers Cos. Inc. inched 0.28% higher to $161.28 Tuesday, on what proved to be an all-around positive trading session for the stock market, with...""}, {""date"": ""20230830065000"", ""headline"": ""Insurance companies in the spotlight as Hurricane Idalia approaches Florida"", ""summary"": ""Looking for stock market analysis and research with proves results? Zacks.com offers in-depth financial research with over 30years of proven results.""}, {""date"": ""20230830074900"", ""headline"": ""Insurance companies in the spotlight as Hurricane Idalia makes landfall in Florida as a Category 3 storm"", ""summary"": ""Insurance stocks rose as Idalia caused widespread flooding and damage while missing the larger population centers along the coast of the Sunshine State.""}, {""date"": ""20230830165600"", ""headline"": ""Travelers Cos. Inc. stock rises Wednesday, still underperforms market"", ""summary"": ""Shares of Travelers Cos. Inc. inched 0.02% higher to $161.32 Wednesday, on what proved to be an all-around favorable trading session for the stock market,...""}, {""date"": ""20230831063027"", ""headline"": ""Travelers Institute Announces Fall 2023 Cybersecurity Education Tour"", ""summary"": ""The Travelers Institute, the public policy division of The Travelers Companies, Inc. , today announced its fall cybersecurity education tour, part of its Cyber: Prepare, Prevent, Mitigate, Restore...""}, {""date"": ""20230831165700"", ""headline"": ""Travelers Cos. Inc. stock outperforms competitors despite losses on the day"", ""summary"": ""Shares of Travelers Cos. Inc. slid 0.06% to $161.23 Thursday, on what proved to be an all-around grim trading session for the stock market, with the S&P 500...""}, {""date"": ""20230901165700"", ""headline"": ""Travelers Cos. Inc. stock outperforms market on strong trading day"", ""summary"": ""Shares of Travelers Cos. Inc. inched 0.66% higher to $162.30 Friday, on what proved to be an all-around favorable trading session for the stock market, with...""}, {""date"": ""20230902121009"", ""headline"": ""Why You Might Be Interested In The Travelers Companies, Inc. (NYSE:TRV) For Its Upcoming Dividend"", ""summary"": ""Regular readers will know that we love our dividends at Simply Wall St, which is why it's exciting to see The Travelers...""}, {""date"": ""20230903081922"", ""headline"": ""Dividend Champion, Contender, And Challenger Highlights: Week Of September 3"", ""summary"": ""A weekly summary of dividend activity for Dividend Champions, Contenders, and Challengers. Click here to read the full September 3 weekly update.""}]",{}
9,2023-09-03,160.40875244140625,2023-09-10,159.01690673828125,-0.008676868823809358,D1,"[{""date"": ""20230903081922"", ""headline"": ""Dividend Champion, Contender, And Challenger Highlights: Week Of September 3"", ""summary"": ""A weekly summary of dividend activity for Dividend Champions, Contenders, and Challengers. Click here to read the full September 3 weekly update.""}, {""date"": ""20230904034700"", ""headline"": ""Price Over Earnings Overview: Travelers Companies"", ""summary"": ""Looking for stock market analysis and research with proves results? Zacks.com offers in-depth financial research with over 30years of proven results.""}, {""date"": ""20230905072051"", ""headline"": ""September Dogs Of The Dow: Walgreens Now Tops All By Yield"", ""summary"": ""There were two Dow Index stocks showing dividends exceeding single share price this month. Click here for a detailed analysis.""}, {""date"": ""20230905165700"", ""headline"": ""Travelers Cos. Inc. stock outperforms competitors despite losses on the day"", ""summary"": ""Shares of Travelers Cos. Inc. slid 1.18% to $160.39 Tuesday, on what proved to be an all-around dismal trading session for the stock market, with the S&P 500...""}, {""date"": ""20230905170100"", ""headline"": ""TRV or ALL: Which P&C Insurance Stock Should You Hold Now?"", ""summary"": ""Let's see how Travelers Companies (TRV) and Allstate Corporation (ALL) fare in terms of some of the key metrics.""}, {""date"": ""20230906165700"", ""headline"": ""Travelers Cos. Inc. stock outperforms market on strong trading day"", ""summary"": ""Shares of Travelers Cos. Inc. inched 0.14% higher to $160.61 Wednesday, on what proved to be an all-around dismal trading session for the stock market, with...""}, {""date"": ""20230907110637"", ""headline"": ""Travelers Companies Inc (TRV): A Deep Dive into its Dividend Performance"", ""summary"": ""The Travelers Companies Inc (NYSE:TRV) recently announced a dividend of $1 per share, payable on 2023-09-29, with the ex-dividend date set for 2023-09-07.  As investors look forward to this upcoming payment, the spotlight also shines on the company's dividend history, yield, and growth rates.  Using the data from GuruFocus, let's deep dive into The Travelers Companies Inc's dividend performance and assess its sustainability.""}, {""date"": ""20230907165700"", ""headline"": ""Travelers Cos. Inc. stock rises Thursday, outperforms market"", ""summary"": ""Shares of Travelers Cos. Inc. inched 0.66% higher to $160.67 Thursday, on what proved to be an all-around mixed trading session for the stock market, with...""}, {""date"": ""20230908035800"", ""headline"": ""Travelers Cos. Inc. stock underperforms Friday when compared to competitors"", ""summary"": ""Looking for stock market analysis and research with proves results? Zacks.com offers in-depth financial research with over 30years of proven results.""}]",{}
10,2023-09-10,159.01690673828125,2023-09-17,163.90008544921875,0.030708550500070375,U4,"[{""date"": ""20230911035800"", ""headline"": ""Travelers Cos. Inc. stock rises Monday, outperforms market"", ""summary"": ""Looking for stock market analysis and research with proves results? Zacks.com offers in-depth financial research with over 30years of proven results.""}, {""date"": ""20230911084600"", ""headline"": ""Travelers, 3M share gains contribute to Dow's 162-point jump"", ""summary"": ""Looking for stock market analysis and research with proves results? Zacks.com offers in-depth financial research with over 30years of proven results.""}, {""date"": ""20230912035800"", ""headline"": ""Travelers Cos. Inc. stock rises Tuesday, outperforms market"", ""summary"": ""Looking for stock market analysis and research with proves results? Zacks.com offers in-depth financial research with over 30years of proven results.""}, {""date"": ""20230912061953"", ""headline"": ""Hartford Financial: Cheap With Catalysts"", ""summary"": ""Hartford Financial is undervalued and has potential for re-rating with strong profitability and share buybacks. Find out why I assign a buy rating to HIG stock.""}, {""date"": ""20230913020300"", ""headline"": ""Looking Into Travelers Companies's Recent Short Interest"", ""summary"": ""Looking for stock market analysis and research with proves results? Zacks.com offers in-depth financial research with over 30years of proven results.""}, {""date"": ""20230913035800"", ""headline"": ""Travelers Cos. Inc. stock outperforms market on strong trading day"", ""summary"": ""Looking for stock market analysis and research with proves results? Zacks.com offers in-depth financial research with over 30years of proven results.""}, {""date"": ""20230913103347"", ""headline"": ""What The Fed Is Poised To Do After August 2023 CPI Report"", ""summary"": ""Inflation rises as CPI increases, leading to selling of small-cap stocks, cereal, telecom and media stocks. Check out my thoughts on next week's Fed rate hikes.""}, {""date"": ""20230913120300"", ""headline"": ""Here's Why Hold Strategy is Apt for Travelers (TRV) Stock"", ""summary"": ""Travelers (TRV) is poised to benefit from strong returns from the non-fixed income portfolio, positive renewal premium change, high levels of retention and prudent capital deployment.""}, {""date"": ""20230913124800"", ""headline"": ""Commit To Buy Travelers Companies At $125, Earn 2.7% Using Options"", ""summary"": ""Looking for stock market analysis and research with proves results? Zacks.com offers in-depth financial research with over 30years of proven results.""}, {""date"": ""20230913130000"", ""headline"": ""Travelers Schedules Conference Call to Review Third Quarter 2023 Results"", ""summary"": ""NEW YORK, September 13, 2023--The Travelers Companies, Inc. (NYSE: TRV) will review its third quarter 2023 results at 9 a.m. ET on Wednesday, Oct. 18, following the release of results earlier that morning.""}, {""date"": ""20230914035800"", ""headline"": ""Travelers Cos. Inc. stock outperforms competitors on strong trading day"", ""summary"": ""Looking for stock market analysis and research with proves results? Zacks.com offers in-depth financial research with over 30years of proven results.""}, {""date"": ""20230915035700"", ""headline"": ""Travelers Cos. Inc. stock falls Friday, still outperforms market"", ""summary"": ""Looking for stock market analysis and research with proves results? Zacks.com offers in-depth financial research with over 30years of proven results.""}]",{}
11,2023-09-17,163.90008544921875,2023-09-24,166.92349243164062,0.018446646773461417,U2,"[{""date"": ""20230918035800"", ""headline"": ""Travelers Cos. Inc. stock rises Monday, outperforms market"", ""summary"": ""Looking for stock market analysis and research with proves results? Zacks.com offers in-depth financial research with over 30years of proven results.""}, {""date"": ""20230918104600"", ""headline"": ""Dow up 89 points on gains for Apple, Travelers shares"", ""summary"": ""Looking for stock market analysis and research with proves results? Zacks.com offers in-depth financial research with over 30years of proven results.""}, {""date"": ""20230918115200"", ""headline"": ""Missed Out on NVDA and META? 3 More AI Stocks to Buy Before It\u2019s Too Late"", ""summary"": ""Looking for stock market analysis and research with proves results? Zacks.com offers in-depth financial research with over 30years of proven results.""}, {""date"": ""20230919035700"", ""headline"": ""Travelers Cos. Inc. stock outperforms competitors on strong trading day"", ""summary"": ""Looking for stock market analysis and research with proves results? Zacks.com offers in-depth financial research with over 30years of proven results.""}, {""date"": ""20230920035700"", ""headline"": ""Travelers Cos. Inc. stock outperforms market on strong trading day"", ""summary"": ""Looking for stock market analysis and research with proves results? Zacks.com offers in-depth financial research with over 30years of proven results.""}, {""date"": ""20230921035700"", ""headline"": ""Travelers Cos. Inc. stock outperforms market despite losses on the day"", ""summary"": ""Looking for stock market analysis and research with proves results? Zacks.com offers in-depth financial research with over 30years of proven results.""}, {""date"": ""20230922035600"", ""headline"": ""Travelers Cos. Inc. stock falls Friday, underperforms market"", ""summary"": ""Looking for stock market analysis and research with proves results? Zacks.com offers in-depth financial research with over 30years of proven results.""}, {""date"": ""20230922100500"", ""headline"": ""$1000 Invested In Travelers Companies 15 Years Ago Would Be Worth This Much Today"", ""summary"": ""Looking for stock market analysis and research with proves results? Zacks.com offers in-depth financial research with over 30years of proven results.""}, {""date"": ""20230924073959"", ""headline"": ""Dividend Champion, Contender, And Challenger Highlights: Week Of September 24"", ""summary"": ""A weekly summary of dividend activity for Dividend Champions, Contenders, and Challengers. Explore more details here.""}]",{}
