,Start Date,Start Price,End Date,End Price,Weekly Returns,Bin Label,News,Basics
0,2023-07-02,171.63636779785156,2023-07-09,169.6497802734375,-0.011574397372203782,D2,"[{""date"": ""20230703114835"", ""headline"": ""Investing in Travelers Companies (NYSE:TRV) three years ago would have delivered you a 62% gain"", ""summary"": ""One simple way to benefit from the stock market is to buy an index fund. But if you pick the right individual stocks...""}, {""date"": ""20230703134200"", ""headline"": ""Insurance Stocks Could Benefit From Hurricane Season"", ""summary"": ""The chances of a major hurricane hitting coastal America this year have ticked up. Market-lagging insurance stocks may see an opportunity for some shares to...""}, {""date"": ""20230705094500"", ""headline"": ""Dow falls nearly 125 points on losses in shares of Dow, Travelers"", ""summary"": ""Dragged down by losses for shares of Dow and Travelers, the Dow Jones Industrial Average is declining Wednesday morning. Shares of Dow and Travelers have...""}, {""date"": ""20230705165500"", ""headline"": ""Travelers Cos. Inc. stock outperforms competitors despite losses on the day"", ""summary"": ""Shares of Travelers Cos. Inc. sank 0.29% to $172.59 Wednesday, on what proved to be an all-around rough trading session for the stock market, with the S&P...""}, {""date"": ""20230706041600"", ""headline"": ""Travelers price target lowered to $176 from $208 at Piper Sandler"", ""summary"": ""Looking for stock market analysis and research with proves results? Zacks.com offers in-depth financial research with over 30years of proven results.""}, {""date"": ""20230706065200"", ""headline"": ""Travelers price target raised to $194 from $185 at JPMorgan"", ""summary"": ""Looking for stock market analysis and research with proves results? Zacks.com offers in-depth financial research with over 30years of proven results.""}, {""date"": ""20230706120600"", ""headline"": ""Piper Sandler Maintains Neutral Rating for Travelers Companies: Here's What You Need To Know"", ""summary"": ""Looking for stock market analysis and research with proves results? Zacks.com offers in-depth financial research with over 30years of proven results.""}, {""date"": ""20230706120600"", ""headline"": ""What 6 Analyst Ratings Have To Say About Travelers Companies"", ""summary"": ""Looking for stock market analysis and research with proves results? Zacks.com offers in-depth financial research with over 30years of proven results.""}, {""date"": ""20230706165400"", ""headline"": ""Travelers Cos. Inc. stock falls Thursday, underperforms market"", ""summary"": ""Shares of Travelers Cos. Inc. shed 0.97% to $170.91 Thursday, on what proved to be an all-around rough trading session for the stock market, with the S&P 500...""}, {""date"": ""20230706172552"", ""headline"": ""Piper Sandler Maintains Travelers Companies (TRV) Neutral Recommendation"", ""summary"": """"}, {""date"": ""20230707165400"", ""headline"": ""Travelers Cos. Inc. stock rises Friday, outperforms market"", ""summary"": ""Shares of Travelers Cos. Inc. inched 0.43% higher to $171.65 Friday, on what proved to be an all-around poor trading session for the stock market, with the...""}, {""date"": ""20230707171840"", ""headline"": ""Buy 3 July Dogs Of The Dow, Watch 6"", ""summary"": ""Analyst 1-year targets showed 10 highest-yield Dow stocks producing 1.62% LESS gain from $5k invested in the lowest-priced 5. Click for our exclusive stock lists.""}]",{}
1,2023-07-09,169.6497802734375,2023-07-16,164.01620483398438,-0.03320708951330831,D4,"[{""date"": ""20230710084700"", ""headline"": ""RBC Capital Sticks to Its Hold Rating for Travelers Companies (TRV)"", ""summary"": ""Looking for stock market analysis and research with proves results? Zacks.com offers in-depth financial research with over 30years of proven results.""}, {""date"": ""20230711082600"", ""headline"": ""Barclays Keeps Their Hold Rating on Travelers Companies (TRV)"", ""summary"": ""Looking for stock market analysis and research with proves results? Zacks.com offers in-depth financial research with over 30years of proven results.""}, {""date"": ""20230711130000"", ""headline"": ""Travelers Earns Top Score on Disability Equality Index\u00ae"", ""summary"": ""HARTFORD, Conn., July 11, 2023--The Travelers Companies, Inc. (NYSE: TRV) today announced that it has earned a top score on the Disability Equality Index\u00ae for the sixth consecutive year, upholding its distinction as a Best Place to Work for Disability Inclusion. Administered by Disability:IN and the American Association of People with Disabilities, the Disability Equality Index is the world\u2019s most comprehensive benchmarking tool to measure a company\u2019s policies and practices related to disability""}, {""date"": ""20230711165500"", ""headline"": ""Travelers Cos. Inc. stock outperforms market on strong trading day"", ""summary"": ""Shares of Travelers Cos. Inc. advanced 1.95% to $172.36 Tuesday, on what proved to be an all-around great trading session for the stock market, with the S&P...""}, {""date"": ""20230712030400"", ""headline"": ""This Is What Whales Are Betting On Travelers Companies"", ""summary"": ""Looking for stock market analysis and research with proves results? Zacks.com offers in-depth financial research with over 30years of proven results.""}, {""date"": ""20230712060916"", ""headline"": ""Travelers Earns Top Score on Disability Equality Index"", ""summary"": ""The Travelers Companies, Inc.  today announced that it has earned a top score on the Disability Equality Index for the sixth consecutive year, upholding its distinction as a Best Place to Work for...""}, {""date"": ""20230712165500"", ""headline"": ""Travelers Cos. Inc. stock outperforms competitors despite losses on the day"", ""summary"": ""Shares of Travelers Cos. Inc. sank 0.72% to $171.12 Wednesday, on what proved to be an all-around positive trading session for the stock market, with the S&P...""}, {""date"": ""20230713023800"", ""headline"": ""Bank Q2 earnings set to kick off with the bar set low as rates stay high"", ""summary"": ""Looking for stock market analysis and research with proves results? Zacks.com offers in-depth financial research with over 30years of proven results.""}, {""date"": ""20230713084700"", ""headline"": ""Morgan Stanley Sticks to Their Hold Rating for Travelers Companies (TRV)"", ""summary"": ""Looking for stock market analysis and research with proves results? Zacks.com offers in-depth financial research with over 30years of proven results.""}, {""date"": ""20230713092400"", ""headline"": ""Video: Dow Movers: TRV, CRM"", ""summary"": ""Looking for stock market analysis and research with proves results? Zacks.com offers in-depth financial research with over 30years of proven results.""}, {""date"": ""20230713095100"", ""headline"": ""Looking Into Travelers Companies's Recent Short Interest"", ""summary"": ""Looking for stock market analysis and research with proves results? Zacks.com offers in-depth financial research with over 30years of proven results.""}, {""date"": ""20230713140045"", ""headline"": ""Analysts Estimate Travelers (TRV) to Report a Decline in Earnings: What to Look Out for"", ""summary"": ""Travelers (TRV) doesn't possess the right combination of the two key ingredients for a likely earnings beat in its upcoming report. Get prepared with the key expectations.""}, {""date"": ""20230713165500"", ""headline"": ""Travelers Cos. Inc. stock underperforms Thursday when compared to competitors"", ""summary"": ""Shares of Travelers Cos. Inc. slipped 1.69% to $168.22 Thursday, on what proved to be an all-around great trading session for the stock market, with the S&P...""}, {""date"": ""20230713203814"", ""headline"": ""Dow Jones Today: Cooling Inflation Sends Index Up"", ""summary"": ""Better-than-expected inflation data prompted investors to send the Dow Jones higher for the fourth day in a row.""}, {""date"": ""20230714010200"", ""headline"": ""Earnings week ahead: Tesla, Netflix, Johnson & Johnson, Bank of America and more"", ""summary"": ""Looking for stock market analysis and research with proves results? Zacks.com offers in-depth financial research with over 30years of proven results.""}, {""date"": ""20230714020200"", ""headline"": ""Catalyst Watch: Microsoft-Activision Blizzard drama, Splunk event and Nasdaq 100 rebalancing countdown"", ""summary"": ""Looking for stock market analysis and research with proves results? Zacks.com offers in-depth financial research with over 30years of proven results.""}, {""date"": ""20230714084800"", ""headline"": ""RBC Capital Reaffirms Their Hold Rating on Travelers Companies (TRV)"", ""summary"": ""Looking for stock market analysis and research with proves results? Zacks.com offers in-depth financial research with over 30years of proven results.""}, {""date"": ""20230714165500"", ""headline"": ""Travelers Cos. Inc. stock underperforms Friday when compared to competitors"", ""summary"": ""Shares of Travelers Cos. Inc. slipped 1.35% to $165.95 Friday, on what proved to be an all-around mixed trading session for the stock market, with the Dow...""}, {""date"": ""20230716044900"", ""headline"": ""Tesla, Netflix, Goldman Earnings Hit The Deck As Q2 Reporting Season Starts In Earnest: Key Companies To Watch In Week Ahead"", ""summary"": ""Looking for stock market analysis and research with proves results? Zacks.com offers in-depth financial research with over 30years of proven results.""}, {""date"": ""20230716072600"", ""headline"": ""Tesla, Netflix, Goldman Earnings To Hit The Deck As Q2 Reporting Season Starts In Earnest: Key Companies To Watch In Week Ahead"", ""summary"": ""Looking for stock market analysis and research with proves results? Zacks.com offers in-depth financial research with over 30years of proven results.""}]",{}
