,Start Date,Start Price,End Date,End Price,Weekly Returns,Bin Label,News,Basics
7,2023-07-23,171.74398803710938,2023-07-30,172.1812286376953,0.0025458859176570314,U1,"[{""date"": ""20230723154135"", ""headline"": ""The Travelers Companies, Inc. (NYSE:TRV) Q2 2023 Earnings Call Transcript"", ""summary"": ""The Travelers Companies, Inc. (NYSE:TRV) Q2 2023 Earnings Call Transcript July 20, 2023 The Travelers Companies, Inc. misses on earnings expectations. Reported EPS is $0.06 EPS, expectations were $2.08. Operator: Good morning, ladies and gentlemen. Welcome to the Second Quarter Results Teleconference for Travelers. [Operator Instructions] As a reminder, this conference is being recorded on [\u2026]""}, {""date"": ""20230724030200"", ""headline"": ""What 5 Analyst Ratings Have To Say About Travelers Companies"", ""summary"": ""Looking for stock market analysis and research with proves results? Zacks.com offers in-depth financial research with over 30years of proven results.""}, {""date"": ""20230724064300"", ""headline"": ""Travelers price target raised to $191 from $188 at Citi"", ""summary"": ""Looking for stock market analysis and research with proves results? Zacks.com offers in-depth financial research with over 30years of proven results.""}, {""date"": ""20230724084700"", ""headline"": ""RBC Capital Reaffirms Their Hold Rating on Travelers Companies (TRV)"", ""summary"": ""Looking for stock market analysis and research with proves results? Zacks.com offers in-depth financial research with over 30years of proven results.""}, {""date"": ""20230724165600"", ""headline"": ""Travelers Cos. Inc. stock outperforms market on strong trading day"", ""summary"": ""Shares of Travelers Cos. Inc. rose 1.17% to $174.84 Monday, on what proved to be an all-around great trading session for the stock market, with the S&P 500...""}, {""date"": ""20230724222948"", ""headline"": ""Citigroup Maintains Travelers Companies (TRV) Neutral Recommendation"", ""summary"": """"}, {""date"": ""20230725073100"", ""headline"": ""Analysts\u2019 Opinions Are Mixed on These Financial Stocks: Travelers Companies (TRV) and Prudential Financial (PRU)"", ""summary"": ""Looking for stock market analysis and research with proves results? Zacks.com offers in-depth financial research with over 30years of proven results.""}, {""date"": ""20230725073700"", ""headline"": ""Travelers price target lowered to $180 from $183 at Jefferies"", ""summary"": ""Looking for stock market analysis and research with proves results? Zacks.com offers in-depth financial research with over 30years of proven results.""}, {""date"": ""20230725232339"", ""headline"": ""Jefferies Maintains Travelers Companies (TRV) Hold Recommendation"", ""summary"": """"}, {""date"": ""20230726035700"", ""headline"": ""Travelers Cos. Inc. stock rises Wednesday, outperforms market"", ""summary"": ""Looking for stock market analysis and research with proves results? Zacks.com offers in-depth financial research with over 30years of proven results.""}, {""date"": ""20230727035700"", ""headline"": ""Travelers Cos. Inc. stock rises Thursday, outperforms market"", ""summary"": ""Looking for stock market analysis and research with proves results? Zacks.com offers in-depth financial research with over 30years of proven results.""}, {""date"": ""20230728035700"", ""headline"": ""Travelers Cos. Inc. stock outperforms competitors despite losses on the day"", ""summary"": ""Looking for stock market analysis and research with proves results? Zacks.com offers in-depth financial research with over 30years of proven results.""}, {""date"": ""20230729033100"", ""headline"": ""Disaster-prone areas are becoming a haven for those seeking cheaper homes - Redfin"", ""summary"": ""Looking for stock market analysis and research with proves results? Zacks.com offers in-depth financial research with over 30years of proven results.""}, {""date"": ""20230729150000"", ""headline"": ""The Best-Managed Companies Have the Most AI Jobs Postings. What Explains That?"", ""summary"": ""It may be a virtuous circle: The most-effective companies are good at looking ahead, and investing in AI makes them the most-effective companies.""}, {""date"": ""20230730024600"", ""headline"": ""Play offense and defense with these barbell stock strategies - BMO"", ""summary"": ""Looking for stock market analysis and research with proves results? Zacks.com offers in-depth financial research with over 30years of proven results.""}]",{}
8,2023-07-30,172.1812286376953,2023-08-06,167.59994506835938,-0.02660733464143117,D3,"[{""date"": ""20230730024600"", ""headline"": ""Play offense and defense with these barbell stock strategies - BMO"", ""summary"": ""Looking for stock market analysis and research with proves results? Zacks.com offers in-depth financial research with over 30years of proven results.""}, {""date"": ""20230801035700"", ""headline"": ""Travelers Cos. Inc. stock outperforms competitors despite losses on the day"", ""summary"": ""Looking for stock market analysis and research with proves results? Zacks.com offers in-depth financial research with over 30years of proven results.""}, {""date"": ""20230801111035"", ""headline"": ""Looking for a Bargain? 7 Blue-Chip Stocks to Buy That Are Down 5% in 2023"", ""summary"": ""The allure of discounted blue-chip stocks shines brighter than ever amid the complex mosaic of the stock market. With the stock market witnessing a rise driven by a handful of names, the flip side reveals several stocks lagging behind indices. This divergence casts a promising light on discounted blue-chip stocks with potential upside waiting to be tapped. The past year has been sobering for the market titans below, undergoing a dip of 5% or more in their stock value. These blue-chip market dips""}, {""date"": ""20230801201720"", ""headline"": ""Insurer AIG profit beats estimates on gains in life and retirement unit"", ""summary"": ""American International Group exceeded second-quarter profit expectations on Tuesday, driven by growth at its life and retirement unit and lower-than-expected catastrophe losses in what was a very expensive quarter for the industry.  AIG, one of the world's biggest commercial insurers, said net premiums written in its general insurance arm for the quarter ended June grew 10% to $7.5 billion.  AIG's life and retirement unit saw a 42% jump in premiums and deposits, partly helped by record sales in fixed index annuities.""}, {""date"": ""20230802035900"", ""headline"": ""Travelers Cos. Inc. stock underperforms Wednesday when compared to competitors"", ""summary"": ""Looking for stock market analysis and research with proves results? Zacks.com offers in-depth financial research with over 30years of proven results.""}, {""date"": ""20230802170900"", ""headline"": ""Insurers Are Facing More Than One Kind of Inflation"", ""summary"": ""Auto and home insurer  Progressive  this week reported a big jump in its combined ratio, which measures underwriting losses and expenses as a percentage of premiums, to 100.4% in the second quarter.  This happened despite 18% growth in net written premiums in the quarter, reflecting the efforts that Progressive and other insurers have been making to push through higher rates to customers.  On the weather front, significant wind, hail and tornado losses accounted for nearly 67 points of loss ratio in Progressive\u2019s property-insurance combined ratio in the second quarter, which was 133.2%, the company reported.""}, {""date"": ""20230803130000"", ""headline"": ""Northland Insurance Launches New Tools to Help Trucking Customers Improve Driver Safety, Mitigate Risk and Reduce Costs"", ""summary"": ""HARTFORD, Conn., August 03, 2023--Northland Insurance, the largest trucking wholesale insurance company in the United States and a subsidiary of The Travelers Companies, Inc. (NYSE: TRV), announced the launch of a telematics program, a cargo theft reporting tool, and a curated set of safety and risk mitigation resources.""}, {""date"": ""20230803165600"", ""headline"": ""Travelers Cos. Inc. stock falls Thursday, underperforms market"", ""summary"": ""Shares of Travelers Cos. Inc. shed 0.99% to $169.40 Thursday, on what proved to be an all-around dismal trading session for the stock market, with the S&P...""}, {""date"": ""20230804165600"", ""headline"": ""Travelers Cos. Inc. stock outperforms market despite losses on the day"", ""summary"": ""Shares of Travelers Cos. Inc. slumped 0.44% to $168.65 Friday, on what proved to be an all-around poor trading session for the stock market, with the S&P 500...""}]",{}
9,2023-08-06,167.59994506835938,2023-08-13,165.8210906982422,-0.01061369303785653,D2,"[{""date"": ""20230807165600"", ""headline"": ""Travelers Cos. Inc. stock rises Monday, still underperforms market"", ""summary"": ""Shares of Travelers Cos. Inc. inched 0.87% higher to $170.12 Monday, on what proved to be an all-around favorable trading session for the stock market, with...""}, {""date"": ""20230808165600"", ""headline"": ""Travelers Cos. Inc. stock falls Tuesday, underperforms market"", ""summary"": ""Shares of Travelers Cos. Inc. shed 1.32% to $167.88 Tuesday, on what proved to be an all-around rough trading session for the stock market, with the S&P 500...""}, {""date"": ""20230808192318"", ""headline"": ""Buy 2 August Dogs Of The Dow, Watch 5"", ""summary"": ""Discover the criteria for stocks to be added to the Dow, the highest-yield stocks in August, and analyst predictions for stocks' performance. Read more here.""}, {""date"": ""20230809165600"", ""headline"": ""Travelers Cos. Inc. stock outperforms market despite losses on the day"", ""summary"": ""Shares of Travelers Cos. Inc. slid 0.35% to $167.29 Wednesday, on what proved to be an all-around dismal trading session for the stock market, with the S&P...""}, {""date"": ""20230810123600"", ""headline"": ""Should You Retain Travelers (TRV) Stock in Your Portfolio?"", ""summary"": ""Travelers (TRV) stands to gain from strong returns from the non-fixed income portfolio, positive renewal premium change, high levels of retention and effective capital deployment.""}, {""date"": ""20230810165600"", ""headline"": ""Travelers Cos. Inc. stock falls Thursday, underperforms market"", ""summary"": ""Shares of Travelers Cos. Inc. slipped 0.21% to $166.94 Thursday, on what proved to be an all-around positive trading session for the stock market, with the...""}, {""date"": ""20230811035700"", ""headline"": ""Travelers Cos. Inc. stock falls Friday, still outperforms market"", ""summary"": ""Looking for stock market analysis and research with proves results? Zacks.com offers in-depth financial research with over 30years of proven results.""}, {""date"": ""20230811215945"", ""headline"": ""12 Undervalued Blue Chip Stocks To Buy According to Wall Street Analysts"", ""summary"": ""In this piece, we will take a look at 12 undervalued blue chip stocks to buy according to Wall Street analysts. If you want to skip our introduction to blue chip stocks, then take a look at 5 Undervalued Blue Chip Stocks To Buy According to Wall Street Analysts. The stock market is made up [\u2026]""}, {""date"": ""20230812083000"", ""headline"": ""TRV: This Blue-Chip Stock Is Cheap Now"", ""summary"": ""Looking for stock market analysis and research with proves results? Zacks.com offers in-depth financial research with over 30years of proven results.""}]",{}
10,2023-08-13,165.8210906982422,2023-08-20,161.4584197998047,-0.02630950550419786,D3,"[{""date"": ""20230814035700"", ""headline"": ""Travelers Cos. Inc. stock underperforms Monday when compared to competitors"", ""summary"": ""Looking for stock market analysis and research with proves results? Zacks.com offers in-depth financial research with over 30years of proven results.""}, {""date"": ""20230815035700"", ""headline"": ""Travelers Cos. Inc. stock falls Tuesday, underperforms market"", ""summary"": ""Looking for stock market analysis and research with proves results? Zacks.com offers in-depth financial research with over 30years of proven results.""}, {""date"": ""20230815180305"", ""headline"": ""Stock futures are little changed as Wall Street looks beyond losing session: Live updates"", ""summary"": ""All three major indexes ended Tuesday's session more than 1% lower.""}, {""date"": ""20230816035700"", ""headline"": ""Travelers Cos. Inc. stock outperforms market on strong trading day"", ""summary"": ""Looking for stock market analysis and research with proves results? Zacks.com offers in-depth financial research with over 30years of proven results.""}, {""date"": ""20230816111200"", ""headline"": ""Dow Breaks Morning Silence, Up Triple Digits"", ""summary"": ""Looking for stock market analysis and research with proves results? Zacks.com offers in-depth financial research with over 30years of proven results.""}, {""date"": ""20230816142926"", ""headline"": ""Insurance Stocks Rise After Strong Progressive Results"", ""summary"": ""Good news from Progressive is giving insurance stocks a lift. Progressive shares rose some 8% after the insurer said it wrote $5.95 billion worth of premiums in July, up 21% from a year ago. That made the stock the S&P 500\u2019s top performer as of midmorning Wednesday.""}, {""date"": ""20230817165600"", ""headline"": ""Travelers Cos. Inc. stock underperforms Thursday when compared to competitors"", ""summary"": ""Shares of Travelers Cos. Inc. shed 1.19% to $163.41 Thursday, on what proved to be an all-around rough trading session for the stock market, with the S&P 500...""}, {""date"": ""20230818165600"", ""headline"": ""Travelers Cos. Inc. stock underperforms Friday when compared to competitors"", ""summary"": ""Shares of Travelers Cos. Inc. slipped 0.58% to $162.47 Friday, on what proved to be an all-around mixed trading session for the stock market, with the Dow...""}]",{}
11,2023-08-20,161.4584197998047,2023-08-27,160.6335906982422,-0.0051086162157738535,D1,"[{""date"": ""20230821165600"", ""headline"": ""Travelers Cos. Inc. stock falls Monday, underperforms market"", ""summary"": ""Shares of Travelers Cos. Inc. dropped 0.54% to $161.60 Monday, on what proved to be an all-around mixed trading session for the stock market, with the S&P...""}, {""date"": ""20230822165448"", ""headline"": ""Best Stocks To Buy Today? 2 Dow Jones Stocks To Know"", ""summary"": ""Dow Jones stocks to check out in the stock market now.""}, {""date"": ""20230822165600"", ""headline"": ""Travelers Cos. Inc. stock falls Tuesday, underperforms market"", ""summary"": ""Shares of Travelers Cos. Inc. slipped 1.03% to $159.94 Tuesday, on what proved to be an all-around poor trading session for the stock market, with the S&P...""}, {""date"": ""20230823165600"", ""headline"": ""Travelers Cos. Inc. stock rises Wednesday, still underperforms market"", ""summary"": ""Shares of Travelers Cos. Inc. inched 0.62% higher to $160.93 Wednesday, on what proved to be an all-around positive trading session for the stock market,...""}, {""date"": ""20230824093000"", ""headline"": ""VinFast soars again and trades at a higher market cap than Walgreens or Goldman Sachs"", ""summary"": ""Looking for stock market analysis and research with proves results? Zacks.com offers in-depth financial research with over 30years of proven results.""}, {""date"": ""20230824133800"", ""headline"": ""5 P&C Insurance Stocks With Modest Dividend Yield to Watch"", ""summary"": ""Here we pick five insurance stocks -- Axis Capital (AXS), American Financial (AFG), First American Financial (FAF), Travelers (TRV) and CNA Financial (CNA) -- with a solid five-year dividend growth history.""}, {""date"": ""20230824165600"", ""headline"": ""Travelers Cos. Inc. stock outperforms competitors on strong trading day"", ""summary"": ""Shares of Travelers Cos. Inc. inched 0.57% higher to $161.84 Thursday, on what proved to be an all-around grim trading session for the stock market, with the...""}, {""date"": ""20230825013000"", ""headline"": ""The Big Reason Your Insurance Is Getting More Expensive"", ""summary"": ""Backed by nearly $1 trillion in capital and rising premiums, insurers might profit from the coming catastrophic weather.""}, {""date"": ""20230825170200"", ""headline"": ""Travelers Cos. Inc. stock falls Friday, underperforms market"", ""summary"": ""Shares of Travelers Cos. Inc. slumped 0.12% to $161.64 Friday, on what proved to be an all-around favorable trading session for the stock market, with the...""}, {""date"": ""20230827102100"", ""headline"": ""It\u2019s a Good Time to Invest in Insurers. This ETF Is a Way to Play the Trend."", ""summary"": ""Property and casualty insurers are hiking premium rates to cover future losses. That bodes well for future profitability.""}]",{}
12,2023-08-27,160.6335906982422,2023-09-03,161.28948974609375,0.004083199815184901,U1,"[{""date"": ""20230827102100"", ""headline"": ""It\u2019s a Good Time to Invest in Insurers. This ETF Is a Way to Play the Trend."", ""summary"": ""Property and casualty insurers are hiking premium rates to cover future losses. That bodes well for future profitability.""}, {""date"": ""20230828104600"", ""headline"": ""See How Travelers Companies Ranks Among Analysts' Top Dow 30 Picks"", ""summary"": ""Looking for stock market analysis and research with proves results? Zacks.com offers in-depth financial research with over 30years of proven results.""}, {""date"": ""20230828104900"", ""headline"": ""Video: Dow Analyst Moves: TRV"", ""summary"": ""Looking for stock market analysis and research with proves results? Zacks.com offers in-depth financial research with over 30years of proven results.""}, {""date"": ""20230828125905"", ""headline"": ""Dow 30 Stocks List: Ranked By Hedge Fund Bullishness Index"", ""summary"": ""In this article, we discuss Dow 30 stocks ranked in accordance with the hedge fund bullishness index. If you want to skip our detailed discussion about the stock market performance, head directly to Top 10 Dow Stocks: Ranked By Hedge Fund Bullishness Index. Dow 30 is a stock index that takes into consideration the performance [\u2026]""}, {""date"": ""20230828165600"", ""headline"": ""Travelers Cos. Inc. stock falls Monday, underperforms market"", ""summary"": ""Shares of Travelers Cos. Inc. slipped 0.50% to $160.83 Monday, on what proved to be an all-around positive trading session for the stock market, with the S&P...""}, {""date"": ""20230829130000"", ""headline"": ""Travelers Institute\u00ae Announces Fall 2023 Cybersecurity Education Tour"", ""summary"": ""HARTFORD, Conn., August 29, 2023--The Travelers Institute, the public policy division of The Travelers Companies, Inc. (NYSE: TRV), today announced its fall cybersecurity education tour, part of its Cyber: Prepare, Prevent, Mitigate, Restore\u00ae series. Educational programs will be hosted in six cities across the United States, offering best practices for effectively preparing for and managing cyber incidents.""}, {""date"": ""20230829165700"", ""headline"": ""Travelers Cos. Inc. stock rises Tuesday, still underperforms market"", ""summary"": ""Shares of Travelers Cos. Inc. inched 0.28% higher to $161.28 Tuesday, on what proved to be an all-around positive trading session for the stock market, with...""}, {""date"": ""20230830065000"", ""headline"": ""Insurance companies in the spotlight as Hurricane Idalia approaches Florida"", ""summary"": ""Looking for stock market analysis and research with proves results? Zacks.com offers in-depth financial research with over 30years of proven results.""}, {""date"": ""20230830074900"", ""headline"": ""Insurance companies in the spotlight as Hurricane Idalia makes landfall in Florida as a Category 3 storm"", ""summary"": ""Insurance stocks rose as Idalia caused widespread flooding and damage while missing the larger population centers along the coast of the Sunshine State.""}, {""date"": ""20230830165600"", ""headline"": ""Travelers Cos. Inc. stock rises Wednesday, still underperforms market"", ""summary"": ""Shares of Travelers Cos. Inc. inched 0.02% higher to $161.32 Wednesday, on what proved to be an all-around favorable trading session for the stock market,...""}, {""date"": ""20230831063027"", ""headline"": ""Travelers Institute Announces Fall 2023 Cybersecurity Education Tour"", ""summary"": ""The Travelers Institute, the public policy division of The Travelers Companies, Inc. , today announced its fall cybersecurity education tour, part of its Cyber: Prepare, Prevent, Mitigate, Restore...""}, {""date"": ""20230831165700"", ""headline"": ""Travelers Cos. Inc. stock outperforms competitors despite losses on the day"", ""summary"": ""Shares of Travelers Cos. Inc. slid 0.06% to $161.23 Thursday, on what proved to be an all-around grim trading session for the stock market, with the S&P 500...""}, {""date"": ""20230901165700"", ""headline"": ""Travelers Cos. Inc. stock outperforms market on strong trading day"", ""summary"": ""Shares of Travelers Cos. Inc. inched 0.66% higher to $162.30 Friday, on what proved to be an all-around favorable trading session for the stock market, with...""}, {""date"": ""20230902121009"", ""headline"": ""Why You Might Be Interested In The Travelers Companies, Inc. (NYSE:TRV) For Its Upcoming Dividend"", ""summary"": ""Regular readers will know that we love our dividends at Simply Wall St, which is why it's exciting to see The Travelers...""}, {""date"": ""20230903081922"", ""headline"": ""Dividend Champion, Contender, And Challenger Highlights: Week Of September 3"", ""summary"": ""A weekly summary of dividend activity for Dividend Champions, Contenders, and Challengers. Click here to read the full September 3 weekly update.""}]",{}
13,2023-09-03,161.28948974609375,2023-09-10,159.88999938964844,-0.008676885013700675,D1,"[{""date"": ""20230903081922"", ""headline"": ""Dividend Champion, Contender, And Challenger Highlights: Week Of September 3"", ""summary"": ""A weekly summary of dividend activity for Dividend Champions, Contenders, and Challengers. Click here to read the full September 3 weekly update.""}, {""date"": ""20230904034700"", ""headline"": ""Price Over Earnings Overview: Travelers Companies"", ""summary"": ""Looking for stock market analysis and research with proves results? Zacks.com offers in-depth financial research with over 30years of proven results.""}, {""date"": ""20230905072051"", ""headline"": ""September Dogs Of The Dow: Walgreens Now Tops All By Yield"", ""summary"": ""There were two Dow Index stocks showing dividends exceeding single share price this month. Click here for a detailed analysis.""}, {""date"": ""20230905165700"", ""headline"": ""Travelers Cos. Inc. stock outperforms competitors despite losses on the day"", ""summary"": ""Shares of Travelers Cos. Inc. slid 1.18% to $160.39 Tuesday, on what proved to be an all-around dismal trading session for the stock market, with the S&P 500...""}, {""date"": ""20230905170100"", ""headline"": ""TRV or ALL: Which P&C Insurance Stock Should You Hold Now?"", ""summary"": ""Let's see how Travelers Companies (TRV) and Allstate Corporation (ALL) fare in terms of some of the key metrics.""}, {""date"": ""20230906165700"", ""headline"": ""Travelers Cos. Inc. stock outperforms market on strong trading day"", ""summary"": ""Shares of Travelers Cos. Inc. inched 0.14% higher to $160.61 Wednesday, on what proved to be an all-around dismal trading session for the stock market, with...""}, {""date"": ""20230907110637"", ""headline"": ""Travelers Companies Inc (TRV): A Deep Dive into its Dividend Performance"", ""summary"": ""The Travelers Companies Inc (NYSE:TRV) recently announced a dividend of $1 per share, payable on 2023-09-29, with the ex-dividend date set for 2023-09-07.  As investors look forward to this upcoming payment, the spotlight also shines on the company's dividend history, yield, and growth rates.  Using the data from GuruFocus, let's deep dive into The Travelers Companies Inc's dividend performance and assess its sustainability.""}, {""date"": ""20230907165700"", ""headline"": ""Travelers Cos. Inc. stock rises Thursday, outperforms market"", ""summary"": ""Shares of Travelers Cos. Inc. inched 0.66% higher to $160.67 Thursday, on what proved to be an all-around mixed trading session for the stock market, with...""}, {""date"": ""20230908035800"", ""headline"": ""Travelers Cos. Inc. stock underperforms Friday when compared to competitors"", ""summary"": ""Looking for stock market analysis and research with proves results? Zacks.com offers in-depth financial research with over 30years of proven results.""}]",{}
