,Start Date,Start Price,End Date,End Price,Weekly Returns,Bin Label,News,Basics
0,2023-06-04,173.0495147705078,2023-06-11,174.50668334960938,0.008420529702345636,U1,"[{""date"": ""20230604022807"", ""headline"": ""Dividend Champion, Contender, And Challenger Highlights: Week Of June 4"", ""summary"": ""A weekly summary of dividend activity for Dividend Champions, Contenders, and Challengers. Companies which changed their dividends. Click here to read the complete list.""}, {""date"": ""20230605045121"", ""headline"": ""June MDA Breakout Stocks/ETFs Week 23 - 2023: High-Frequency Gainers To Give You An Edge"", ""summary"": ""Read more to see the two new Breakout Stocks for Week 23 with better than 10% short-term upside, ETF updates, and one Dow 30 Pick.""}, {""date"": ""20230605165200"", ""headline"": ""5 Dividend-Paying P&C Insurers to Build a Steady Portfolio"", ""summary"": ""Property and casualty players like The Travelers Companies (TRV), AXIS Capital (AXS), CNA Financial (CNA) American Financial Group (AFG) and First American Financial (FAF), which have an impressive dividend history, offer a breather amid volatility.""}, {""date"": ""20230605165200"", ""headline"": ""Travelers Cos. Inc. stock outperforms competitors despite losses on the day"", ""summary"": ""Shares of Travelers Cos. Inc. slumped 0.43% to $174.37 Monday, on what proved to be an all-around rough trading session for the stock market, with the S&P...""}, {""date"": ""20230606035400"", ""headline"": ""Travelers Cos. Inc. stock outperforms competitors on strong trading day"", ""summary"": ""Looking for stock market analysis and research with proves results? Zacks.com offers in-depth financial research with over 30years of proven results.""}, {""date"": ""20230607165300"", ""headline"": ""Travelers Cos. Inc. stock rises Wednesday, outperforms market"", ""summary"": ""Shares of Travelers Cos. Inc. inched 0.47% higher to $175.78 Wednesday, on what proved to be an all-around mixed trading session for the stock market, with...""}, {""date"": ""20230608165300"", ""headline"": ""Travelers Cos. Inc. stock rises Thursday, still underperforms market"", ""summary"": ""Shares of Travelers Cos. Inc. inched 0.07% higher to $174.91 Thursday, on what proved to be an all-around positive trading session for the stock market, with...""}, {""date"": ""20230609014500"", ""headline"": ""Budget Committee launches probe into insurers' climate risk assessment"", ""summary"": ""Looking for stock market analysis and research with proves results? Zacks.com offers in-depth financial research with over 30years of proven results.""}, {""date"": ""20230609165300"", ""headline"": ""Travelers Cos. Inc. stock outperforms market on strong trading day"", ""summary"": ""Shares of Travelers Cos. Inc. inched 0.39% higher to $175.60 Friday, on what proved to be an all-around favorable trading session for the stock market, with...""}, {""date"": ""20230611053203"", ""headline"": ""June MDA Breakout Stocks/ETFs Week 24 - 2023: High-Frequency Gainers To Give You An Edge"", ""summary"": ""The MDA breakout picks continue to beat the S&P 500 into 7 consecutive years now delivering +865.4% compound returns through 2023. Click here to read more.""}]",{}
1,2023-06-11,174.50668334960938,2023-06-18,175.64950561523438,0.006548873909519193,U1,"[{""date"": ""20230611053203"", ""headline"": ""June MDA Breakout Stocks/ETFs Week 24 - 2023: High-Frequency Gainers To Give You An Edge"", ""summary"": ""The MDA breakout picks continue to beat the S&P 500 into 7 consecutive years now delivering +865.4% compound returns through 2023. Click here to read more.""}, {""date"": ""20230612104700"", ""headline"": ""See How Travelers Companies Ranks Among Analysts' Top Dow 30 Picks"", ""summary"": ""Looking for stock market analysis and research with proves results? Zacks.com offers in-depth financial research with over 30years of proven results.""}, {""date"": ""20230612104700"", ""headline"": ""Video: Dow Analyst Moves: TRV"", ""summary"": ""Looking for stock market analysis and research with proves results? Zacks.com offers in-depth financial research with over 30years of proven results.""}, {""date"": ""20230612165300"", ""headline"": ""Travelers Cos. Inc. stock falls Monday, underperforms market"", ""summary"": ""Shares of Travelers Cos. Inc. slid 0.47% to $174.77 Monday, on what proved to be an all-around positive trading session for the stock market, with the S&P...""}, {""date"": ""20230613110600"", ""headline"": ""Here's How Much You Would Have Made Owning Travelers Companies Stock In The Last 15 Years"", ""summary"": ""Looking for stock market analysis and research with proves results? Zacks.com offers in-depth financial research with over 30years of proven results.""}, {""date"": ""20230613175700"", ""headline"": ""Travelers Cos. Inc. stock outperforms competitors on strong trading day"", ""summary"": ""Shares of Travelers Cos. Inc. inched 0.77% higher to $176.12 Tuesday, on what proved to be an all-around positive trading session for the stock market, with...""}, {""date"": ""20230614130000"", ""headline"": ""Travelers Schedules Conference Call to Review Second Quarter 2023 Results"", ""summary"": ""NEW YORK, June 14, 2023--The Travelers Companies, Inc. (NYSE: TRV) will review its second quarter 2023 results at 9 a.m. ET on Thursday, July 20, following the release of results earlier that morning.""}, {""date"": ""20230614133000"", ""headline"": ""More Inflation, Less Flo, Can Be Winning Combo for Progressive"", ""summary"": ""Auto insurers such as Progressive are finally seeing rates start to catch up to rising repair costs, and cutting ad budgets can help.""}, {""date"": ""20230614165300"", ""headline"": ""Travelers Cos. Inc. stock falls Wednesday, underperforms market"", ""summary"": ""Shares of Travelers Cos. Inc. shed 1.46% to $173.55 Wednesday, on what proved to be an all-around mixed trading session for the stock market, with the S&P...""}, {""date"": ""20230615101300"", ""headline"": ""August 18th Options Now Available For Travelers Companies (TRV)"", ""summary"": ""Looking for stock market analysis and research with proves results? Zacks.com offers in-depth financial research with over 30years of proven results.""}, {""date"": ""20230615130000"", ""headline"": ""Travelers Reveals Most Common Wedding Claims of 2022"", ""summary"": ""HARTFORD, Conn., June 15, 2023--The Travelers Companies, Inc. (NYSE: TRV) today revealed the most common wedding insurance claims of 2022. Vendor-related issues topped the list for the second consecutive year, representing nearly one-third (31%) of all paid claims.""}, {""date"": ""20230615165400"", ""headline"": ""Travelers Cos. Inc. stock rises Thursday, outperforms market"", ""summary"": ""Shares of Travelers Cos. Inc. rose 1.39% to $175.97 Thursday, on what proved to be an all-around favorable trading session for the stock market, with the S&P...""}, {""date"": ""20230616165300"", ""headline"": ""Travelers Cos. Inc. stock outperforms market on strong trading day"", ""summary"": ""Shares of Travelers Cos. Inc. inched 0.44% higher to $176.75 Friday, on what proved to be an all-around poor trading session for the stock market, with the...""}]",{}
2,2023-06-18,175.64950561523438,2023-06-25,172.6383819580078,-0.01714279608519098,D2,"[{""date"": ""20230619110900"", ""headline"": ""Here's Why Hold Strategy is Apt for Travelers (TRV) Stock"", ""summary"": ""Travelers (TRV) stands to gain from strong returns from the non-fixed income portfolio, positive renewal premium change, high levels of retention and effective capital deployment.""}, {""date"": ""20230619140700"", ""headline"": ""Travelers Announces the Start of the 2023 Travelers Championship"", ""summary"": ""HARTFORD, Conn., June 19, 2023--The Travelers Companies, Inc. (NYSE: TRV) today announced the start of the 2023 Travelers Championship at TPC River Highlands in Cromwell, Connecticut. This year\u2019s tournament, which is a PGA TOUR designated event with a tournament-record purse, features eight of the top 10 players in the Official World Golf Ranking, led by No. 1 Scottie Scheffler. The field also includes Jon Rahm (No. 2), Rory McIlroy (No. 3), Patrick Cantlay (No. 4), Viktor Hovland (No. 5), defen""}, {""date"": ""20230620030400"", ""headline"": ""Where Travelers Companies Stands With Analysts"", ""summary"": ""Looking for stock market analysis and research with proves results? Zacks.com offers in-depth financial research with over 30years of proven results.""}, {""date"": ""20230620051205"", ""headline"": ""June MDA Breakout Stocks/ETFs Week 25 - 2023: High-Frequency Gainers To Give You An Edge"", ""summary"": ""Two new Breakout Stocks for Week 25 with better than 10% short-term upside, ETF updates, and two Dow 30 Picks. Check out the MDA breakout picks for next week.""}, {""date"": ""20230620053100"", ""headline"": ""Travelers initiated with an Equal Weight at Morgan Stanley"", ""summary"": ""Looking for stock market analysis and research with proves results? Zacks.com offers in-depth financial research with over 30years of proven results.""}, {""date"": ""20230620090400"", ""headline"": ""Philip Morris upgraded, Palantir downgraded: Wall Street's top analyst calls"", ""summary"": ""Looking for stock market analysis and research with proves results? Zacks.com offers in-depth financial research with over 30years of proven results.""}, {""date"": ""20230620100700"", ""headline"": ""Benzinga's Top Ratings Upgrades, Downgrades For June 20, 2023"", ""summary"": ""Looking for stock market analysis and research with proves results? Zacks.com offers in-depth financial research with over 30years of proven results.""}, {""date"": ""20230620103000"", ""headline"": ""Morgan Stanley bullish on P&C insurers; Arch Capital, Everest Re rated Overweight"", ""summary"": ""Looking for stock market analysis and research with proves results? Zacks.com offers in-depth financial research with over 30years of proven results.""}, {""date"": ""20230620134005"", ""headline"": ""Why Travelers (TRV) is a Top Value Stock for the Long-Term"", ""summary"": ""Whether you're a value, growth, or momentum investor, finding strong stocks becomes easier with the Zacks Style Scores, a top feature of the Zacks Premium research service.""}, {""date"": ""20230620165400"", ""headline"": ""Travelers Cos. Inc. stock falls Tuesday, underperforms market"", ""summary"": ""Shares of Travelers Cos. Inc. sank 0.67% to $175.56 Tuesday, on what proved to be an all-around dismal trading session for the stock market, with the S&P 500...""}, {""date"": ""20230620171607"", ""headline"": ""Morgan Stanley Initiates Coverage of Travelers Companies (TRV) with Equal-Weight Recommendation"", ""summary"": """"}, {""date"": ""20230621165400"", ""headline"": ""Travelers Cos. Inc. stock underperforms Wednesday when compared to competitors"", ""summary"": ""Shares of Travelers Cos. Inc. slid 0.15% to $175.29 Wednesday, on what proved to be an all-around grim trading session for the stock market, with the S&P 500...""}, {""date"": ""20230622165300"", ""headline"": ""Travelers Cos. Inc. stock falls Thursday, underperforms market"", ""summary"": ""Shares of Travelers Cos. Inc. slid 0.16% to $175.01 Thursday, on what proved to be an all-around mixed trading session for the stock market, with the S&P 500...""}, {""date"": ""20230622180600"", ""headline"": ""5 Low-Beta Insurance Stocks to Beat Market Volatility"", ""summary"": ""Here we pick five low-beta stocks that are poised to deliver steady performance irrespective of market conditions.""}, {""date"": ""20230623165300"", ""headline"": ""Travelers Cos. Inc. stock outperforms market despite losses on the day"", ""summary"": ""Shares of Travelers Cos. Inc. slipped 0.74% to $173.72 Friday, on what proved to be an all-around rough trading session for the stock market, with the S&P...""}, {""date"": ""20230623201334"", ""headline"": ""15 Largest Auto Insurance Companies In The US"", ""summary"": ""In this article, we will be taking a look at the 15 largest auto insurance companies in the US. To skip our industry discussion and see the 5 largest companies, you can go directly to go to 5 Largest Auto Insurance Companies In The US. The significant technological advances being made in the automobile industry, [\u2026]""}, {""date"": ""20230625102854"", ""headline"": ""Dividend Champion, Contender, And Challenger Highlights: Week Of June 25"", ""summary"": ""A weekly summary of dividend activity for Dividend Champions, Contenders, and Challengers. Read more to see the June 25th weekly update.""}, {""date"": ""20230625232100"", ""headline"": ""2023 Travelers Championship Generates More Than $3 Million for Charity"", ""summary"": ""HARTFORD, Conn., June 25, 2023--The Travelers Companies, Inc. (NYSE: TRV) today announced that the 2023 Travelers Championship generated a tournament-record amount for charity \u2013 more than $3 million for more than 160 nonprofits.""}]",{}
3,2023-06-25,172.6383819580078,2023-07-02,172.57875061035156,-0.0003454118775901849,D1,"[{""date"": ""20230625102854"", ""headline"": ""Dividend Champion, Contender, And Challenger Highlights: Week Of June 25"", ""summary"": ""A weekly summary of dividend activity for Dividend Champions, Contenders, and Challengers. Read more to see the June 25th weekly update.""}, {""date"": ""20230625232100"", ""headline"": ""2023 Travelers Championship Generates More Than $3 Million for Charity"", ""summary"": ""HARTFORD, Conn., June 25, 2023--The Travelers Companies, Inc. (NYSE: TRV) today announced that the 2023 Travelers Championship generated a tournament-record amount for charity \u2013 more than $3 million for more than 160 nonprofits.""}, {""date"": ""20230626165300"", ""headline"": ""Travelers Cos. Inc. stock falls Monday, underperforms market"", ""summary"": ""Shares of Travelers Cos. Inc. slumped 0.77% to $172.39 Monday, on what proved to be an all-around grim trading session for the stock market, with the S&P 500...""}, {""date"": ""20230627165300"", ""headline"": ""Travelers Cos. Inc. stock rises Tuesday, still underperforms market"", ""summary"": ""Shares of Travelers Cos. Inc. inched 0.12% higher to $172.59 Tuesday, on what proved to be an all-around favorable trading session for the stock market, with...""}, {""date"": ""20230628025500"", ""headline"": ""RSI Alert: Travelers Companies Now Oversold"", ""summary"": ""Looking for stock market analysis and research with proves results? Zacks.com offers in-depth financial research with over 30years of proven results.""}, {""date"": ""20230628094500"", ""headline"": ""Intel, Travelers share losses contribute to Dow's 111-point fall"", ""summary"": ""The Dow Jones Industrial Average is falling Wednesday morning with shares of Intel and Travelers delivering the stiffest headwinds for the index. The Dow was...""}, {""date"": ""20230628130000"", ""headline"": ""Travelers Publishes Its 2022 Sustainability Report"", ""summary"": ""HARTFORD, Conn., June 28, 2023--The Travelers Companies, Inc. (NYSE: TRV) today published its 2022 Sustainability Report, which discusses the inextricable link between the company\u2019s mission of creating shareholder value and its purpose of taking care of the people it is privileged to serve \u2013 its customers, communities and employees. The report features a number of corporate initiatives, as well as the company\u2019s latest reports consistent with the recommendations of the Task Force on Climate-relat""}, {""date"": ""20230628165400"", ""headline"": ""Travelers Cos. Inc. stock falls Wednesday, underperforms market"", ""summary"": ""Shares of Travelers Cos. Inc. slid 2.45% to $168.37 Wednesday, on what proved to be an all-around grim trading session for the stock market, with the S&P 500...""}, {""date"": ""20230629165400"", ""headline"": ""Travelers Cos. Inc. stock rises Thursday, outperforms market"", ""summary"": ""Shares of Travelers Cos. Inc. rallied 1.56% to $170.99 Thursday, on what proved to be an all-around great trading session for the stock market, with the S&P...""}, {""date"": ""20230630110800"", ""headline"": ""15 Stocks Up, 15 Stocks Down: A Look At The Dow Jones Industrial Average Halfway Through 2023"", ""summary"": ""Looking for stock market analysis and research with proves results? Zacks.com offers in-depth financial research with over 30years of proven results.""}, {""date"": ""20230630134011"", ""headline"": ""Are Investors Undervaluing The Travelers Companies (TRV) Right Now?"", ""summary"": ""Here at Zacks, our focus is on the proven Zacks Rank system, which emphasizes earnings estimates and estimate revisions to find great stocks. Nevertheless, we are always paying attention to the latest value, growth, and momentum trends to underscore strong picks.""}, {""date"": ""20230630165500"", ""headline"": ""Travelers Cos. Inc. stock rises Friday, outperforms market"", ""summary"": ""Shares of Travelers Cos. Inc. rose 1.56% to $173.66 Friday, on what proved to be an all-around great trading session for the stock market, with the S&P 500...""}]","{""bookValue"": 21855, ""cashRatio"": 0.16951527038386102, ""ev"": 47176.773, ""fcfPerShareTTM"": 27.8943, ""longtermDebtTotalAsset"": 0.0658, ""longtermDebtTotalCapital"": 0.2654, ""longtermDebtTotalEquity"": 0.3629, ""netDebtToTotalCapital"": 0.2485, ""netDebtToTotalEquity"": 0.3398, ""pb"": 1.8188, ""peTTM"": 17.7935, ""pfcfTTM"": 6.2256, ""ptbv"": 1.8427, ""roaTTM"": 0.0191, ""roeTTM"": 0.1035, ""roicTTM"": 0.0768, ""rotcTTM"": 0.095, ""tangibleBookValue"": 21572, ""totalDebtToEquity"": 0.3675, ""totalDebtToTotalAsset"": 0.0666, ""totalDebtToTotalCapital"": 0.2687, ""totalRatio"": 1.2214, ""period"": ""2023-06-30""}"
4,2023-07-02,172.57875061035156,2023-07-09,170.5812530517578,-0.01157441198020781,D2,"[{""date"": ""20230703114835"", ""headline"": ""Investing in Travelers Companies (NYSE:TRV) three years ago would have delivered you a 62% gain"", ""summary"": ""One simple way to benefit from the stock market is to buy an index fund. But if you pick the right individual stocks...""}, {""date"": ""20230703134200"", ""headline"": ""Insurance Stocks Could Benefit From Hurricane Season"", ""summary"": ""The chances of a major hurricane hitting coastal America this year have ticked up. Market-lagging insurance stocks may see an opportunity for some shares to...""}, {""date"": ""20230705094500"", ""headline"": ""Dow falls nearly 125 points on losses in shares of Dow, Travelers"", ""summary"": ""Dragged down by losses for shares of Dow and Travelers, the Dow Jones Industrial Average is declining Wednesday morning. Shares of Dow and Travelers have...""}, {""date"": ""20230705165500"", ""headline"": ""Travelers Cos. Inc. stock outperforms competitors despite losses on the day"", ""summary"": ""Shares of Travelers Cos. Inc. sank 0.29% to $172.59 Wednesday, on what proved to be an all-around rough trading session for the stock market, with the S&P...""}, {""date"": ""20230706041600"", ""headline"": ""Travelers price target lowered to $176 from $208 at Piper Sandler"", ""summary"": ""Looking for stock market analysis and research with proves results? Zacks.com offers in-depth financial research with over 30years of proven results.""}, {""date"": ""20230706065200"", ""headline"": ""Travelers price target raised to $194 from $185 at JPMorgan"", ""summary"": ""Looking for stock market analysis and research with proves results? Zacks.com offers in-depth financial research with over 30years of proven results.""}, {""date"": ""20230706120600"", ""headline"": ""Piper Sandler Maintains Neutral Rating for Travelers Companies: Here's What You Need To Know"", ""summary"": ""Looking for stock market analysis and research with proves results? Zacks.com offers in-depth financial research with over 30years of proven results.""}, {""date"": ""20230706120600"", ""headline"": ""What 6 Analyst Ratings Have To Say About Travelers Companies"", ""summary"": ""Looking for stock market analysis and research with proves results? Zacks.com offers in-depth financial research with over 30years of proven results.""}, {""date"": ""20230706165400"", ""headline"": ""Travelers Cos. Inc. stock falls Thursday, underperforms market"", ""summary"": ""Shares of Travelers Cos. Inc. shed 0.97% to $170.91 Thursday, on what proved to be an all-around rough trading session for the stock market, with the S&P 500...""}, {""date"": ""20230706172552"", ""headline"": ""Piper Sandler Maintains Travelers Companies (TRV) Neutral Recommendation"", ""summary"": """"}, {""date"": ""20230707165400"", ""headline"": ""Travelers Cos. Inc. stock rises Friday, outperforms market"", ""summary"": ""Shares of Travelers Cos. Inc. inched 0.43% higher to $171.65 Friday, on what proved to be an all-around poor trading session for the stock market, with the...""}, {""date"": ""20230707171840"", ""headline"": ""Buy 3 July Dogs Of The Dow, Watch 6"", ""summary"": ""Analyst 1-year targets showed 10 highest-yield Dow stocks producing 1.62% LESS gain from $5k invested in the lowest-priced 5. Click for our exclusive stock lists.""}]","{""bookValue"": 21855, ""cashRatio"": 0.16951527038386102, ""ev"": 47176.773, ""fcfPerShareTTM"": 27.8943, ""longtermDebtTotalAsset"": 0.0658, ""longtermDebtTotalCapital"": 0.2654, ""longtermDebtTotalEquity"": 0.3629, ""netDebtToTotalCapital"": 0.2485, ""netDebtToTotalEquity"": 0.3398, ""pb"": 1.8188, ""peTTM"": 17.7935, ""pfcfTTM"": 6.2256, ""ptbv"": 1.8427, ""roaTTM"": 0.0191, ""roeTTM"": 0.1035, ""roicTTM"": 0.0768, ""rotcTTM"": 0.095, ""tangibleBookValue"": 21572, ""totalDebtToEquity"": 0.3675, ""totalDebtToTotalAsset"": 0.0666, ""totalDebtToTotalCapital"": 0.2687, ""totalRatio"": 1.2214, ""period"": ""2023-06-30""}"
